question_id,question_string,answer_llm,answer_gold,precision-1,recall-1,ROUGE-1,precision-2,recall-2,ROUGE-2,factual_correctness,completeness,relevance,justification,depth,overall_score,pass
P3_Q3,"Unter welchen spezifischen Bedingungen wählt das System Counting Sort, Radix Sort oder QuickSort, basierend auf den Werten von k und H?","Um die Frage zu beantworten, benötige ich den spezifischen Kontext, der die Bedingungen beschreibt, unter denen das System Counting Sort, Radix Sort oder QuickSort wählt. Da der Kontext nicht bereitgestellt wurde, kann ich nur allgemeine Informationen zu den Algorithmen geben:

1. **Counting Sort**: Dieser Algorithmus ist effizient, wenn die Werte, die sortiert werden sollen, in einem begrenzten Bereich liegen. Er ist besonders geeignet, wenn \( k \) (die größte Zahl im Bereich der Eingabewerte) relativ klein ist im Vergleich zur Anzahl der zu sortierenden Elemente \( n \). Counting Sort hat eine Zeitkomplexität von \( O(n + k) \).

2. **Radix Sort**: Radix Sort wird oft verwendet, wenn die Eingabewerte aus mehreren Stellen bestehen, wie z.B. bei Zahlen oder Strings. Er ist effizient, wenn die Anzahl der Stellen \( d \) und die Basis \( b \) (z.B. 10 für Dezimalzahlen) klein sind. Die Zeitkomplexität von Radix Sort ist \( O(d \cdot (n + b)) \).

3. **QuickSort**: QuickSort ist ein sehr effizienter und weit verbreiteter Sortieralgorithmus, der im Durchschnitt eine Zeitkomplexität von \( O(n \log n) \) hat. Er wird oft gewählt,Um die Frage zu beantworten, wie das Defence-in-Depth-Modell strukturiert ist und welche Überschneidungen zwischen den Bereichen Risk Assessment, Development und Control bestehen, betrachten wir die typischen Merkmale dieses Modells:

1. **Risk Assessment (Risikobewertung):** Dieser Bereich konzentriert sich auf die Identifizierung und Bewertung potenzieller Risiken und Bedrohungen. Es geht darum, Schwachstellen zu erkennen und die Wahrscheinlichkeit sowie die Auswirkungen von Sicherheitsvorfällen zu analysieren.

2. **Development (Entwicklung):** In diesem Bereich werden Sicherheitsmaßnahmen in den Entwicklungsprozess integriert. Dies umfasst die Implementierung von Sicherheitsprotokollen und -technologien während der Software- oder Systementwicklung, um potenzielle Schwachstellen von Anfang an zu minimieren.

3. **Control (Kontrolle):** Hierbei handelt es sich um die Implementierung von Sicherheitskontrollen und -mechanismen, um den Schutz von Systemen und Daten zu gewährleisten. Dazu gehören Firewalls, Intrusion Detection Systems und regelmäßige Sicherheitsüberprüfungen.

**Überschneidungen zwischen den Bereichen:**

- Zwischen **Risk Assessment** und **Development** besteht eine Überschneidung, da die Ergebnisse der Risikobewertung direkt in den Entwicklungsprozess einfließen sollten, um Sicherheitsanforderungen zu definieren und umzusetzen.

- Zwischen **Development** und **Control** gibt es eine Überschneidung, da die während der Entwicklung implementierten Sicherheitsmaßnahmen durch Kontrollmechanismen überwacht und aufrechterhalten werden müssen.

- Zwischen **Risk Assessment** und **Control** besteht eine Überschneidung, da kontinuierliche Risikobewertungen notwendig sind, um die Wirksamkeit der bestehenden Kontrollen zu überprüfen und anzupassen.

Das Defence-in-Depth-Modell ist so strukturiert, dass es mehrere Schichten von Sicherheitsmaßnahmen bietet, die zusammenarbeiten, um ein System umfassend zu schützen. Die Überschneidungen zwischen den Bereichen gewährleisten, dass Sicherheitsmaßnahmen kohärent und effektiv sind., was bei unglücklicher Wahl des Pivots passieren kann.

Ohne den spezifischen Kontext kann ich nicht genau sagen, welche Bedingungen für die Wahl eines dieser Algorithmen basierend auf den Werten von \( k \) und \( H \) gelten. Bitte stelle den Kontext zur Verfügung, damit ich eine präzisere Antwort geben kann.","Das System implementiert eine hierarchische Entscheidungslogik basierend auf den Werten von k und H: Counting Sort wird gewählt, wenn k ≤ 1000 (kleine Schlüsselbereiche) für optimale lineare Zeitkomplexität; Radix Sort kommt zum Einsatz, wenn k > 10⁶ UND H < 0.7·log₂(k) (große Bereiche mit strukturierten, niedrig-entropischen Daten) für überlegene Speichercharakteristika; QuickSort dient als Fallback-Strategie für alle anderen allgemeinen Fälle und gewährleistet robuste O(n log n) Performance. Zusätzlich wird Insertion Sort automatisch für sehr kleine Datensätze (n ≤ 20) ausgewählt, um dessen exceptional Cache-Effizienz in diesem Bereich zu nutzen.",0.12307692307692308,0.36363636363636365,0.18390804597701152,0.03088803088803089,0.09195402298850575,0.04624277456647399,1,1,1,1,1,5,False
P3_Q4,Welche Performance-Verbesserungen (in Prozent) wurden im Vergleich zu statischen Sortieralgorithmen auf verschiedenen Datensätzen erzielt?,"Um die Frage zu beantworten, benötige ich den spezifischen Kontext, der die Informationen über die Performance-Verbesserungen im Vergleich zu statischen Sortieralgorithmen enthält. Bitte füge den relevanten Kontext hinzu, damit ich die Frage präzise beantworten kann.","Die experimentellen Ergebnisse zeigen signifikante Performance-Steigerungen: AHS erreichte 30-40% Reduktion der Ausführungszeit gegenüber konventionellen statischen Sortieralgorithmen across diverse Datensätze. Bei großskaligen Benchmarks mit n = 10⁹ Elementen benötigte AHS nur 210 Sekunden gegenüber 380 Sekunden für Timsort, was einer 45% Verbesserung entspricht. Für mittlere Datensätze (n = 10⁷) wurde ein 1.8× Speedup (2.1s vs 3.8s) erreicht, während die Speichernutzung konstant bei 8GB blieb gegenüber 12GB für Counting Sort, was die Eignung für moderne Big-Data-Anwendungen demonstriert.",0.14285714285714285,0.06666666666666667,0.09090909090909091,0.029411764705882353,0.013513513513513514,0.01851851851851852,0,0,0,0,0,0,False
P3_Q5,"Wie wurde die Hardware-aware Optimierung implementiert, insbesondere die dynamische Anpassung von k_max basierend auf L3-Cache und Thread Count?","Es tut mir leid, aber ohne den spezifischen Kontext kann ich nicht genau sagen, wie die Hardware-aware Optimierung in Bezug auf die dynamische Anpassung von \( k_{\text{max}} \) basierend auf dem L3-Cache und der Anzahl der Threads implementiert wurde. Wenn du mir den Kontext zur Verfügung stellst, kann ich dir eine detaillierte Antwort geben.","Die Hardware-aware Optimierung implementiert eine dynamische Anpassung von kmax basierend auf Systemressourcen gemäß der Formel kmax = (L3 Cache)/(4 × Thread Count). Diese Implementierung gewährleistet Thread-Parallelismus bei gleichzeitig speichereffizienter Cache-Nutzung und resultierte in einer 12% Erhöhung der Cache-Auslastung verglichen mit statischen Ansätzen. Das System aktiviert konditionale Parallelisierung nur wenn vorteilhaft: Radix Sort zeigt besonders effektive Skalierung mit 1.79× Speedup für Datensätze > 10⁶ Elemente trotz 12% Thread-Management-Overhead, während Quicksort aufgrund signifikanter Synchronisationskosten (47% Overhead) limitierte Parallelisierbarkeit (1.12× Speedup) aufweist.",0.24074074074074073,0.16455696202531644,0.1954887218045113,0.07547169811320754,0.05128205128205128,0.061068702290076333,0,0,1,0,0,1,False
P3_META_Q1,Wer sind die Autoren des Papers 'Adaptive Hybrid Sort: Dynamic Strategy Selection for Optimal Sorting'?,"Es tut mir leid, aber ohne den spezifischen Kontext oder den Text des Papers kann ich die Autoren des Papers 'Adaptive Hybrid Sort: Dynamic Strategy Selection for Optimal Sorting' nicht nennen. Wenn du den Kontext oder weitere Informationen bereitstellen kannst, helfe ich dir gerne weiter.",Shrinivass Arunachalam Balasubramanian,0.0,0.0,0.0,0.0,0.0,0.0,0,0,1,0,0,1,False
P3_META_Q2,Welche Forschungsmethodik wurde im Paper 'Adaptive Hybrid Sort: Dynamic Strategy Selection for Optimal Sorting' hauptsächlich angewandt?,"Um die Frage zu beantworten, benötige ich den spezifischen Kontext oder Inhalt des Papers 'Adaptive Hybrid Sort: Dynamic Strategy Selection for Optimal Sorting'. Da der Kontext nicht bereitgestellt wurde, kann ich nur allgemein über Forschungsmethoden in solchen Arbeiten sprechen.

In einem Paper, das sich mit einem Algorithmus wie 'Adaptive Hybrid Sort' beschäftigt, könnte die Forschungsmethodik typischerweise Folgendes umfassen:

1. **Algorithmus-Design und -Entwicklung**: Die Autoren könnten einen neuen Sortieralgorithmus entworfen haben, der adaptive und hybride Strategien kombiniert.

2. **Theoretische Analyse**: Eine Analyse der Zeit- und Speicherkomplexität des Algorithmus, um seine Effizienz im Vergleich zu bestehenden Algorithmen zu bewerten.

3. **Experimentelle Evaluation**: Durchführung von Experimenten, um die Leistung des Algorithmus in der Praxis zu testen. Dies könnte den Vergleich mit anderen Sortieralgorithmen auf verschiedenen Datensätzen umfassen.

4. **Dynamische Strategieauswahl**: Untersuchung und Implementierung von Mechanismen, die es dem Algorithmus ermöglichen, zur Laufzeit die beste Sortierstrategie basierend auf den Eingabedaten auszuwählen.

Ohne den spezifischen Kontext des Papers kann ich jedoch nicht genau sagen, welche dieser Methoden oder welche andere spezifische Methodik tatsächlich angewandt wurde. Wenn Sie den Kontext bereitstellen können, kann ich eine genauere Antwort geben.","Die Forschungsmethodik des Adaptive Hybrid Sort Papers basiert hauptsächlich auf einem experimentellen Algorithm-Engineering-Ansatz, der empirische Evaluation mit theoretischer Fundierung kombiniert. Das Vorgehen umfasst: (1) Systematic Algorithm Design durch Entwicklung einer adaptiven Hybrid-Architektur mit Feature-Extraktion und ML-basierter Entscheidungsfindung, (2) Comprehensive Benchmarking mit 15 sorgfältig konstruierten Datensätzen spanning drei Kategorien (synthetisch, real-world, edge cases) zur Stress-Testing aller Entscheidungspfade, (3) Machine Learning Integration durch Training eines XGBoost-Klassifikators auf 10.000 synthetischen Datensätzen mit 92.4% Accuracy, (4) Multi-objective Optimization mittels Bayesian Optimization zur Threshold-Kalibrierung mit gewichteter Zeit-Speicher-Tradeoff-Funktion, und (5) Comparative Performance Analysis gegen etablierte Baseline-Algorithmen (Timsort, Introsort, Radix Sort, Counting Sort) mit detailliertem Microbenchmarking unter kontrollierten Bedingungen. Die Methodologie wird durch formale Verifikation der Korrektheit via struktureller Induktion und theoretische Komplexitätsanalyse ergänzt, wobei die Evaluation auf einer Windows 11/WSL2-Umgebung mit TypeScript/Node.js-Implementation durchgeführt wurde.",0.10989010989010989,0.15625,0.12903225806451615,0.0,0.0,0.0,1,1,1,1,1,5,False
P4_Q1,Welche spezifischen CUPTI-Tabellen wurden analysiert und wie viele Entitäten enthielt jede Tabelle nach dem Left-Join?,"Es tut mir leid, aber ohne den spezifischen Kontext kann ich nicht genau sagen, welche CUPTI-Tabellen analysiert wurden und wie viele Entitäten jede Tabelle nach dem Left-Join enthielt. Bitte stelle sicher, dass der relevante Kontext oder die Informationen bereitgestellt werden, damit ich die Frage beantworten kann.","Laut Tabelle 1 wurden drei spezifische CUPTI-Tabellen analysiert: KERNEL (CUPTI_ACTIVITY_KIND_KERNEL) mit 842.054 Entitäten für alle Ranks, MEMCPY (CUPTI_ACTIVITY_KIND_MEMCPY) mit variierenden Entitäten pro Rank (107.045 für Rank 0, 107.099 für Rank 1, 1.070.545 für Rank 2, und 107.045 für Rank 3), sowie GPU (TARGET_INFO_GPU) mit 4 Entitäten für alle Ranks. Nach dem Left-Join-Prozess ergaben sich approximativ 93 Millionen Entitäten, die zur weiteren Analyse verwendet wurden.",0.15217391304347827,0.109375,0.1272727272727273,0.0,0.0,0.0,0,0,0,0,0,0,False
P4_Q2,Warum entschieden sich die Autoren für Block Partitioning statt Cyclic Partitioning bei der Verteilung der Shards auf MPI-Ranks?,"Es tut mir leid, aber ohne den spezifischen Kontext aus dem Dokument kann ich nicht genau sagen, warum die Autoren sich für Block Partitioning statt Cyclic Partitioning entschieden haben. Im Allgemeinen könnte die Entscheidung für Block Partitioning über Cyclic Partitioning auf Faktoren wie die Einfachheit der Implementierung, die Effizienz der Datenlokalität oder die spezifischen Anforderungen der Anwendung zurückzuführen sein. Block Partitioning kann in einigen Fällen eine bessere Leistung bieten, wenn die Datenzugriffe lokalisiert sind und die Kommunikation zwischen den Prozessen minimiert werden soll. Wenn du mir den spezifischen Kontext aus dem Dokument zur Verfügung stellst, kann ich eine genauere Antwort geben.","Die Autoren entschieden sich für Block Partitioning über Cyclic Partitioning, da der Datensatz statisch ist und eine hohe Workload-Vorhersagbarkeit aufweist. Block Partitioning weist zusammenhängende Shards jedem Rank zu, was den Query-Overhead reduziert, die Datenlokalität verbessert und eine effiziente SQL-Query-Ausführung ermöglicht. Diese Methode ist besonders vorteilhaft für statische Datensätze, da sie die Kommunikationskosten zwischen den Ranks minimiert und die Cache-Effizienz maximiert.",0.22772277227722773,0.38333333333333336,0.28571428571428575,0.08,0.13559322033898305,0.10062893081761008,1,1,1,1,1,5,False
P4_Q3,Welche Methode wurde zur Identifikation der Top-5 anomalous shards verwendet und wie funktioniert diese?,"Um die Frage zu beantworten, benötige ich den spezifischen Kontext, der die Methode zur Identifikation der Top-5 anomalous shards beschreibt. Bitte füge den relevanten Textabschnitt hinzu, damit ich dir eine präzise Antwort geben kann.","Zur Identifikation der Top-5 anomalous Shards verwendeten die Autoren die Inter-Quartile Range (IQR) Methode. Diese statistische Methode berechnet zunächst gemeinsame Statistiken (Minimum, Maximum, Standardabweichung) kollaborativ über alle P Ranks in einem Round-Robin-Verfahren. Anschließend werden diese gemeinsamen Statistiken verwendet, um Anomalien zu identifizieren, wobei die IQR-Methode Ausreißer basierend auf der Verteilung der Daten innerhalb der Quartile bestimmt und die fünf auffälligsten Shards zur detaillierten Analyse auswählt.",0.29411764705882354,0.15384615384615385,0.20202020202020204,0.09090909090909091,0.046875,0.06185567010309278,0,0,1,0,0,1,False
P4_Q4,Was zeigt die Analyse der Memory Stall Duration für Rank 2 bezüglich der Device-to-Host und Host-to-Device Transfers?,"Es tut mir leid, aber ohne den spezifischen Kontext kann ich die Frage nicht direkt beantworten. Wenn du mir den relevanten Kontext oder die Daten zur Verfügung stellst, kann ich dir eine genauere Antwort geben.","Die Analyse der Memory Stall Duration für Rank 2 ergab, dass Device-to-Host und Host-to-Device Transfers dominieren, was auf häufige Ping-Pong-Muster hindeutet, die durch ineffiziente Batch-Verarbeitung verursacht werden. Im Gegensatz dazu zeigen spärliche Device-to-Device Transfers seltene Intra-GPU-Operationen an, was Optimierungsmöglichkeiten durch Shared Memory Reuse oder Tiling-Strategien aufzeigt. Diese Erkenntnisse deuten darauf hin, dass die Datenübertragungseffizienz zwischen Host und Device ein kritischer Engpass für die Performance darstellt.",0.08571428571428572,0.046153846153846156,0.06,0.0,0.0,0.0,0,0,0,0,0,0,False
P4_Q5,Wie skaliert die Performance des Frameworks mit zunehmender Anzahl von MPI-Ranks für Data Generation und Data Aggregation?,"Um die Frage zu beantworten, benötige ich den spezifischen Kontext, der Informationen über die Skalierung der Performance des Frameworks mit der Anzahl der MPI-Ranks für Data Generation und Data Aggregation enthält. Bitte füge den relevanten Kontext hinzu, damit ich eine präzise Antwort geben kann.","Das Framework zeigt eine positive Skalierung mit zunehmender Anzahl von MPI-Ranks, wobei sowohl die Data Generation als auch die Data Aggregation Phase eine Verringerung der Ausführungszeit bei steigender Rank-Anzahl aufweisen. Figure 1(c) demonstriert, dass sich die Zeiten für beide Phasen mit mehr MPI-Ranks reduzieren, was beweist, dass die Pipeline skalierbar ist und große Datenmengen effizient verarbeiten kann. Diese Skalierbarkeit wird durch die verteilte Architektur ermöglicht, die die Arbeitslast gleichmäßig auf alle verfügbaren Ranks verteilt und Bottlenecks vermeidet.",0.3409090909090909,0.19480519480519481,0.24793388429752067,0.046511627906976744,0.02631578947368421,0.03361344537815126,0,0,1,0,0,1,False
P4_META_Q1,Wer sind die Autoren des Papers 'Scalable GPU Performance Variability Analysis framework'?,"Es tut mir leid, aber ohne den spezifischen Kontext oder den Text des Papers kann ich die Autoren des Papers 'Scalable GPU Performance Variability Analysis framework' nicht nennen. Wenn du den Kontext oder weitere Informationen bereitstellen kannst, helfe ich dir gerne weiter.",Ankur Lahiry and Ayush Pokharel and Seth Ockerman and Amal Gueroudji and Line Pouchard and Tanzima Z. Islam,0.0,0.0,0.0,0.0,0.0,0.0,0,0,1,0,0,1,False
P4_META_Q2,Welche Forschungsmethodik wurde im Paper 'Scalable GPU Performance Variability Analysis framework' hauptsächlich angewandt?,"Um die Frage zu beantworten, benötige ich den spezifischen Kontext oder Inhalt des Papers 'Scalable GPU Performance Variability Analysis framework'. Da der Kontext nicht bereitgestellt wurde, kann ich keine genaue Antwort geben. Wenn du mir mehr Informationen oder einen Auszug aus dem Paper zur Verfügung stellst, kann ich dir besser helfen.","Die Autoren entwickelten ein distributed data analysis framework als technische Lösung für das Problem der skalierbaren Analyse von GPU-Performance-Logs. Die Forschungsmethodik umfasste mehrere Komponenten: Zunächst wurde ein zweistufiges Pipeline-Design entworfen, bestehend aus einer Data Generation Phase zur Extraktion und Sharding von Execution Traces und einer Data Aggregation Phase zur Konsolidierung und Analyse der Daten. Das Framework wurde dann experimentell auf dem Texas Advanced Computing Center's Lonestar6 Supercomputer evaluiert, wobei reale HPC- und AI-Workload-Daten von Nsight Compute Traces verwendet wurden. Die empirische Evaluation erfolgte durch Performance-Messungen mit verschiedenen MPI-Konfigurationen, um die Skalierbarkeit des Systems zu demonstrieren. Zusätzlich wendeten die Autoren statistische Analysemethoden wie die Inter-Quartile Range (IQR) zur Anomalieerkennung an und führten eine detaillierte Analyse der Memory Stall Patterns durch. Die Methodik folgt dem typischen Systems Research Ansatz: Problemidentifikation (Skalierbarkeit von GPU-Performance-Analyse), Systemdesign (distributed framework), Implementierung, experimentelle Evaluation auf realer Hardware und empirische Analyse der Ergebnisse zur Validierung der Effektivität des vorgeschlagenen Ansatzes.",0.13725490196078433,0.046052631578947366,0.06896551724137931,0.0,0.0,0.0,0,0,0,0,0,0,False
P5_Q1,"Wie wird das Defence-in-Depth-Modell konkret strukturiert und welche spezifischen Überschneidungen bestehen zwischen den drei Hauptbereichen Risk Assessment, Development und Control?","Um die Frage zu beantworten, wie das Defence-in-Depth-Modell strukturiert ist und welche Überschneidungen zwischen den Bereichen Risk Assessment, Development und Control bestehen, betrachten wir die typischen Merkmale dieses Modells:

1. **Risk Assessment (Risikobewertung):** Dieser Bereich konzentriert sich auf die Identifizierung und Bewertung potenzieller Risiken und Bedrohungen. Es geht darum, Schwachstellen zu erkennen und die Wahrscheinlichkeit sowie die Auswirkungen von Sicherheitsvorfällen zu analysieren.

2. **Development (Entwicklung):** In diesem Bereich werden Sicherheitsmaßnahmen in den Entwicklungsprozess integriert. Dies umfasst die Implementierung von Sicherheitsprotokollen und -technologien während der Software- oder Systementwicklung, um potenzielle Schwachstellen von Anfang an zu minimieren.

3. **Control (Kontrolle):** Hierbei handelt es sich um die Implementierung von Sicherheitskontrollen und -mechanismen, um den Schutz von Systemen und Daten zu gewährleisten. Dazu gehören Firewalls, Intrusion Detection Systems und regelmäßige Sicherheitsüberprüfungen.

**Überschneidungen zwischen den Bereichen:**

- Zwischen **Risk Assessment** und **Development** besteht eine Überschneidung, da die Ergebnisse der Risikobewertung direkt in den Entwicklungsprozess einfließen sollten, um Sicherheitsanforderungen zu definieren und umzusetzen.

- Zwischen **Development** und **Control** gibt es eine Überschneidung, da die während der Entwicklung implementierten Sicherheitsmaßnahmen durch Kontrollmechanismen überwacht und aufrechterhalten werden müssen.

- Zwischen **Risk Assessment** und **Control** besteht eine Überschneidung, da kontinuierliche Risikobewertungen notwendig sind, um die Wirksamkeit der bestehenden Kontrollen zu überprüfen und anzupassen.

Das Defence-in-Depth-Modell ist so strukturiert, dass es mehrere Schichten von Sicherheitsmaßnahmen bietet, die zusammenarbeiten, um ein System umfassend zu schützen. Die Überschneidungen zwischen den Bereichen gewährleisten, dass Sicherheitsmaßnahmen kohärent und effektiv sind.","Das Defence-in-Depth-Modell strukturiert die AI Safety Forschung in drei Hauptbereiche: Risk Assessment (Bewertung der Schwere und Wahrscheinlichkeit potenzieller Schäden), Development (Entwicklung vertrauenswürdiger, zuverlässiger und sicherer Systeme) und Control (Überwachung und Intervention nach der Bereitstellung). Die spezifischen Überschneidungen werden in Figure 1 als Venn-Diagramm illustriert: Zwischen Assessment und Development liegt Specification, validation, assurance, zwischen Assessment und Control Real-time monitoring, zwischen Development und Control E.g. jailbreak refusal, und im Zentrum aller drei Bereiche befinden sich grundlegende Sicherheitstechniken. Diese Überschneidungen entstehen durch unterschiedliche Definitionen dessen, was als Teil des Systems versus als kontrollierende Feedback-Schleifen betrachtet wird.",0.13559322033898305,0.34408602150537637,0.1945288753799392,0.01702127659574468,0.043478260869565216,0.024464831804281346,2,1,2,1,1,7,True
P5_Q2,"Welche acht Personen bildeten das Expert Planning Committee und aus welchen Institutionen stammten sie, und wie gestaltete sich der mehrstufige Feedback-Prozess zur Konsensbildung?","Es tut mir leid, aber ohne den spezifischen Kontext kann ich die Frage nicht direkt beantworten. Wenn du mir den relevanten Kontext oder Textausschnitt zur Verfügung stellst, kann ich dir gerne weiterhelfen.","Das Expert Planning Committee bestand aus acht Personen: Dawn Song (UC Berkeley), Lan Xue (Tsinghua University), Luke Ong (Nanyang Technological University), Max Tegmark (MIT), Stuart Russell (UC Berkeley), Tegan Maharaj (MILA), Ya-Qin Zhang (Tsinghua University) und Yoshua Bengio (MILA). Der mehrstufige Feedback-Prozess gestaltete sich folgendermaßen: Zunächst erstellte das Committee einen Konsultationsentwurf, der an alle Konferenzteilnehmer verteilt wurde, um umfassendes Feedback einzuholen. Nach mehreren Runden von schriftlichen und persönlichen Rückmeldungen der Teilnehmer wurde das Dokument überarbeitet, um Punkte des breiten Konsenses unter den diversen Forschern zu synthetisieren.",0.03125,0.011627906976744186,0.01694915254237288,0.0,0.0,0.0,0,0,0,0,0,0,False
P5_Q3,Was sind 'Areas of mutual interest' im Kontext der AI Safety Forschung und welche konkreten Beispiele werden für potentiell kooperative Forschungsbereiche genannt?,"Um die Frage zu beantworten, benötige ich den spezifischen Kontext, auf den du dich beziehst. Bitte stelle sicher, dass der relevante Text oder die Informationen, die den Kontext bilden, bereitgestellt werden, damit ich eine präzise Antwort geben kann.","Areas of mutual interest bezeichnen Forschungsbereiche, bei denen verschiedene Akteure (Unternehmen, Länder) trotz Konkurrenz gemeinsame Interessen haben und Anreize bestehen, Informationen und Forschungsergebnisse zu teilen. Das Paper gibt konkrete Beispiele: bestimmte Verifikationsmechanismen, Risikomanagement-Standards und Risikobewertungen, da diese minimalen Wettbewerbsvorteil bieten, aber einem gemeinsamen Interesse dienen. Ähnlich wie konkurrierende Flugzeughersteller (Boeing und Airbus) bei Flugsicherheitsinformationen und -standards kooperieren, könnten AI-Akteure bei der Zusammenarbeit profitieren, da niemand von AI-Zwischenfällen oder der Ermächtigung böswilliger Akteure profitiert.",0.07894736842105263,0.0410958904109589,0.05405405405405406,0.0,0.0,0.0,0,0,0,0,0,0,False
P5_Q4,Welche spezifischen Definitionen werden für die Begriffe 'Artificial General Intelligence (AGI)' und 'Artificial Superintelligence (ASI)' im Glossar gegeben?,"Es tut mir leid, aber der Kontext, den Sie erwähnt haben, fehlt in Ihrer Anfrage. Um die spezifischen Definitionen für 'Artificial General Intelligence (AGI)' und 'Artificial Superintelligence (ASI)' aus einem Glossar zu geben, benötige ich den entsprechenden Text oder die Definitionen, die im Glossar bereitgestellt werden. Wenn Sie den Kontext oder die Definitionen bereitstellen können, helfe ich Ihnen gerne weiter.","Das Glossar definiert Artificial General Intelligence (AGI) als AI that can do most cognitive work as well as humans. This implies that it is highly autonomous and can do most economically valuable remote work as well as humans. Artificial Superintelligence (ASI) wird definiert als AI that can accomplish any cognitive work far beyond human level. Zusätzlich wird AGI in Figure 2 als Schnittmenge von drei Eigenschaften dargestellt: Autonomy (A), Generality (G) und Intelligence (I), wobei Systeme mit allen drei Eigenschaften am schwierigsten zu kontrollieren sind.",0.11666666666666667,0.08235294117647059,0.09655172413793102,0.01694915254237288,0.011904761904761904,0.013986013986013986,0,0,0,0,0,0,False
