question_id,question_string,answer_llm,answer_gold,precision-1,recall-1,ROUGE-1,precision-2,recall-2,ROUGE-2
P3_Q3,"Unter welchen spezifischen Bedingungen wählt das System Counting Sort, Radix Sort oder QuickSort, basierend auf den Werten von k und H?","Um zu entscheiden, welches Sortierverfahren – Counting Sort, Radix Sort oder QuickSort – basierend auf den Werten von \( k \) (der Bereich der Schlüsselwerte) und \( H \) (die Anzahl der zu sortierenden Elemente) gewählt werden sollte, können folgende Überlegungen angestellt werden:

1. **Counting Sort**: Dieses Sortierverfahren ist besonders effizient, wenn der Bereich der Schlüsselwerte \( k \) relativ klein ist im Vergleich zur Anzahl der Elemente \( H \). Die Zeitkomplexität von Counting Sort ist \( O(k + H) \), was bedeutet, dass es sehr schnell ist, wenn \( k \) nicht viel größer als \( H \) ist. Es ist jedoch nicht geeignet, wenn \( k \) sehr groß ist, da der Speicherbedarf und die Laufzeit dann stark ansteigen.

2. **Radix Sort**: Radix Sort ist dann vorteilhaft, wenn die Schlüsselwerte aus mehreren Ziffern bestehen und jede Ziffer einen begrenzten Bereich hat. Es ist besonders effizient, wenn die Anzahl der Ziffern (oder Stellen) klein ist und Counting Sort auf die einzelnen Ziffern angewendet werden kann. Die Komplexität ist \( O(d \cdot (k + H)) \), wobei \( d \) die Anzahl der Ziffern ist. Radix Sort ist ideal, wenn \( k \) groß ist, aber die Anzahl der Ziffern \( d \) klein ist.

3. **QuickSort**: QuickSort ist ein allgemeines Sortierverfahren, das gut funktioniert, wenn keine speziellen Bedingungen für \( k \) und \( H \) vorliegen. Es hat eine durchschnittliche Zeitkomplexität von \( O(H \log H) \) und ist oft die bevorzugte Wahl für allgemeine Sortieraufgaben, insbesondere wenn der Speicherverbrauch eine Rolle spielt, da es in-place arbeitet. QuickSort ist flexibel und effizient für eine Vielzahl von Eingaben, aber es kann im schlimmsten Fall \( O(H^2) \) Zeit benötigen, wenn die Pivot-Auswahl ungünstig ist.

Zusammengefasst:
- **Counting Sort**: Wählen, wenn \( k \) klein ist.
- **Radix Sort**: Wählen, wenn \( k \) groß ist, aber die Schlüsselwerte aus wenigen Ziffern bestehen.
- **QuickSort**: Wählen, wenn keine speziellen Bedingungen vorliegen oder wenn Speicherplatz begrenzt ist.","Das System implementiert eine hierarchische Entscheidungslogik basierend auf den Werten von k und H: Counting Sort wird gewählt, wenn k ≤ 1000 (kleine Schlüsselbereiche) für optimale lineare Zeitkomplexität; Radix Sort kommt zum Einsatz, wenn k > 10⁶ UND H < 0.7·log₂(k) (große Bereiche mit strukturierten, niedrig-entropischen Daten) für überlegene Speichercharakteristika; QuickSort dient als Fallback-Strategie für alle anderen allgemeinen Fälle und gewährleistet robuste O(n log n) Performance. Zusätzlich wird Insertion Sort automatisch für sehr kleine Datensätze (n ≤ 20) ausgewählt, um dessen exceptional Cache-Effizienz in diesem Bereich zu nutzen.",0.08256880733944955,0.3068181818181818,0.13012048192771086,0.018404907975460124,0.06896551724137931,0.029055690072639227
P3_Q4,Welche Performance-Verbesserungen (in Prozent) wurden im Vergleich zu statischen Sortieralgorithmen auf verschiedenen Datensätzen erzielt?,"Um die Frage zu beantworten, benötige ich spezifische Informationen aus dem Kontext, der die Performance-Verbesserungen von dynamischen oder anderen Sortieralgorithmen im Vergleich zu statischen Sortieralgorithmen beschreibt. Da der Kontext nicht bereitgestellt wurde, kann ich keine genauen Prozentzahlen nennen. Wenn Sie jedoch Details oder Daten aus dem Kontext bereitstellen können, helfe ich Ihnen gerne weiter, die Performance-Verbesserungen zu analysieren.","Die experimentellen Ergebnisse zeigen signifikante Performance-Steigerungen: AHS erreichte 30-40% Reduktion der Ausführungszeit gegenüber konventionellen statischen Sortieralgorithmen across diverse Datensätze. Bei großskaligen Benchmarks mit n = 10⁹ Elementen benötigte AHS nur 210 Sekunden gegenüber 380 Sekunden für Timsort, was einer 45% Verbesserung entspricht. Für mittlere Datensätze (n = 10⁷) wurde ein 1.8× Speedup (2.1s vs 3.8s) erreicht, während die Speichernutzung konstant bei 8GB blieb gegenüber 12GB für Counting Sort, was die Eignung für moderne Big-Data-Anwendungen demonstriert.",0.08620689655172414,0.06666666666666667,0.07518796992481204,0.017543859649122806,0.013513513513513514,0.015267175572519083
P3_Q5,"Wie wurde die Hardware-aware Optimierung implementiert, insbesondere die dynamische Anpassung von k_max basierend auf L3-Cache und Thread Count?","Um die Hardware-aware Optimierung zu implementieren, wurde eine dynamische Anpassung von \( k_{\text{max}} \) basierend auf dem L3-Cache und der Anzahl der Threads vorgenommen. Diese Anpassung berücksichtigt die spezifischen Hardware-Ressourcen, um die Leistung zu optimieren. Der Wert von \( k_{\text{max}} \) wird so gewählt, dass er optimal in den verfügbaren L3-Cache passt und gleichzeitig die Anzahl der verfügbaren Threads effizient nutzt. Dies ermöglicht eine bessere Nutzung der Hardware und verbessert die Gesamtleistung der Anwendung.","Die Hardware-aware Optimierung implementiert eine dynamische Anpassung von kmax basierend auf Systemressourcen gemäß der Formel kmax = (L3 Cache)/(4 × Thread Count). Diese Implementierung gewährleistet Thread-Parallelismus bei gleichzeitig speichereffizienter Cache-Nutzung und resultierte in einer 12% Erhöhung der Cache-Auslastung verglichen mit statischen Ansätzen. Das System aktiviert konditionale Parallelisierung nur wenn vorteilhaft: Radix Sort zeigt besonders effektive Skalierung mit 1.79× Speedup für Datensätze > 10⁶ Elemente trotz 12% Thread-Management-Overhead, während Quicksort aufgrund signifikanter Synchronisationskosten (47% Overhead) limitierte Parallelisierbarkeit (1.12× Speedup) aufweist.",0.1891891891891892,0.17721518987341772,0.1830065359477124,0.0684931506849315,0.0641025641025641,0.0662251655629139
P4_Q1,Welche spezifischen CUPTI-Tabellen wurden analysiert und wie viele Entitäten enthielt jede Tabelle nach dem Left-Join?,"Um die Frage zu beantworten, welche spezifischen CUPTI-Tabellen analysiert wurden und wie viele Entitäten jede Tabelle nach dem Left-Join enthielt, benötige ich mehr Informationen aus dem Kontext, der diese Tabellen und die Ergebnisse des Left-Joins beschreibt. Da der Kontext nicht bereitgestellt wurde, kann ich keine spezifischen Tabellen oder Entitätenzahlen nennen. Bitte geben Sie den relevanten Kontext oder die Details an, damit ich Ihnen weiterhelfen kann.","Laut Tabelle 1 wurden drei spezifische CUPTI-Tabellen analysiert: KERNEL (CUPTI_ACTIVITY_KIND_KERNEL) mit 842.054 Entitäten für alle Ranks, MEMCPY (CUPTI_ACTIVITY_KIND_MEMCPY) mit variierenden Entitäten pro Rank (107.045 für Rank 0, 107.099 für Rank 1, 1.070.545 für Rank 2, und 107.045 für Rank 3), sowie GPU (TARGET_INFO_GPU) mit 4 Entitäten für alle Ranks. Nach dem Left-Join-Prozess ergaben sich approximativ 93 Millionen Entitäten, die zur weiteren Analyse verwendet wurden.",0.1076923076923077,0.109375,0.10852713178294573,0.0,0.0,0.0
P4_Q2,Warum entschieden sich die Autoren für Block Partitioning statt Cyclic Partitioning bei der Verteilung der Shards auf MPI-Ranks?,"Ohne den spezifischen Kontext der Autoren zu kennen, kann ich allgemeine Gründe nennen, warum sich Entwickler oder Forscher für Block Partitioning anstelle von Cyclic Partitioning bei der Verteilung von Shards auf MPI-Ranks entscheiden könnten:

1. **Datenlokalität**: Block Partitioning kann die Datenlokalität verbessern, da zusammenhängende Datenblöcke einem einzelnen MPI-Rank zugewiesen werden. Dies kann die Effizienz von Speicherzugriffen und die Nutzung von Cache verbessern.

2. **Kommunikationsaufwand**: Bei Block Partitioning ist der Kommunikationsaufwand zwischen den MPI-Ranks oft geringer, da weniger Daten zwischen den Ranks ausgetauscht werden müssen. Cyclic Partitioning kann zu einer gleichmäßigeren Lastverteilung führen, erfordert jedoch häufig mehr Kommunikation zwischen den Ranks.

3. **Einfachheit der Implementierung**: Block Partitioning ist oft einfacher zu implementieren und zu verwalten, da es weniger komplexe Berechnungen für die Zuweisung von Daten zu Ranks erfordert.

4. **Lastverteilung**: In einigen Fällen kann Block Partitioning eine ausreichende Lastverteilung bieten, insbesondere wenn die Daten gleichmäßig verteilt sind oder wenn die Berechnungen pro Datenblock ähnlich sind.

5. **Spezifische Anwendungsanforderungen**: Die Wahl der Partitionierungsstrategie hängt oft von den spezifischen Anforderungen der Anwendung ab. Block Partitioning könnte besser zu den Anforderungen der Anwendung passen, die die Autoren untersuchen.

Ohne weitere Details aus dem spezifischen Kontext der Autoren ist dies jedoch eine allgemeine Einschätzung.","Die Autoren entschieden sich für Block Partitioning über Cyclic Partitioning, da der Datensatz statisch ist und eine hohe Workload-Vorhersagbarkeit aufweist. Block Partitioning weist zusammenhängende Shards jedem Rank zu, was den Query-Overhead reduziert, die Datenlokalität verbessert und eine effiziente SQL-Query-Ausführung ermöglicht. Diese Methode ist besonders vorteilhaft für statische Datensätze, da sie die Kommunikationskosten zwischen den Ranks minimiert und die Cache-Effizienz maximiert.",0.1457286432160804,0.48333333333333334,0.22393822393822393,0.03535353535353535,0.11864406779661017,0.05447470817120623
P4_Q3,Welche Methode wurde zur Identifikation der Top-5 anomalous shards verwendet und wie funktioniert diese?,"Um die Frage zu beantworten, benötige ich spezifische Informationen aus dem Kontext, der die Methode zur Identifikation der Top-5 anomalous shards beschreibt. Da der Kontext nicht bereitgestellt wurde, kann ich keine genaue Methode nennen. 

Allgemein werden jedoch zur Identifikation von Anomalien in Daten häufig Methoden wie statistische Analysen, maschinelles Lernen (z.B. Clustering-Algorithmen oder Anomalieerkennungsalgorithmen wie Isolation Forest oder One-Class SVM) oder regelbasierte Ansätze verwendet. Diese Methoden analysieren typischerweise Muster in den Daten und identifizieren Abweichungen von diesen Mustern, die als Anomalien betrachtet werden können.

Wenn Sie mir mehr Details aus dem Kontext geben können, helfe ich Ihnen gerne weiter, die spezifische Methode zu identifizieren und zu erklären, wie sie funktioniert.","Zur Identifikation der Top-5 anomalous Shards verwendeten die Autoren die Inter-Quartile Range (IQR) Methode. Diese statistische Methode berechnet zunächst gemeinsame Statistiken (Minimum, Maximum, Standardabweichung) kollaborativ über alle P Ranks in einem Round-Robin-Verfahren. Anschließend werden diese gemeinsamen Statistiken verwendet, um Anomalien zu identifizieren, wobei die IQR-Methode Ausreißer basierend auf der Verteilung der Daten innerhalb der Quartile bestimmt und die fünf auffälligsten Shards zur detaillierten Analyse auswählt.",0.18181818181818182,0.3076923076923077,0.2285714285714286,0.027522935779816515,0.046875,0.034682080924855495
P4_Q4,Was zeigt die Analyse der Memory Stall Duration für Rank 2 bezüglich der Device-to-Host und Host-to-Device Transfers?,"Um die Frage zu beantworten, müsste ich spezifische Informationen aus der Analyse der Memory Stall Duration für Rank 2 haben, insbesondere in Bezug auf die Transfers von Device-to-Host und Host-to-Device. Da diese Informationen im Kontext nicht bereitgestellt werden, kann ich keine genaue Antwort geben. 

Im Allgemeinen bezieht sich die ""Memory Stall Duration"" auf die Zeit, in der ein Prozessor oder eine GPU auf Daten aus dem Speicher wartet, was die Leistung beeinträchtigen kann. Eine Analyse könnte zeigen, ob die Transfers zwischen Gerät und Host (und umgekehrt) effizient sind oder ob sie Engpässe verursachen. Wenn die Memory Stall Duration hoch ist, könnte dies darauf hindeuten, dass die Datenübertragung ein Flaschenhals ist.","Die Analyse der Memory Stall Duration für Rank 2 ergab, dass Device-to-Host und Host-to-Device Transfers dominieren, was auf häufige Ping-Pong-Muster hindeutet, die durch ineffiziente Batch-Verarbeitung verursacht werden. Im Gegensatz dazu zeigen spärliche Device-to-Device Transfers seltene Intra-GPU-Operationen an, was Optimierungsmöglichkeiten durch Shared Memory Reuse oder Tiling-Strategien aufzeigt. Diese Erkenntnisse deuten darauf hin, dass die Datenübertragungseffizienz zwischen Host und Device ein kritischer Engpass für die Performance darstellt.",0.23636363636363636,0.4,0.29714285714285715,0.08256880733944955,0.140625,0.10404624277456646
P4_Q5,Wie skaliert die Performance des Frameworks mit zunehmender Anzahl von MPI-Ranks für Data Generation und Data Aggregation?,"Um die Skalierung der Performance eines Frameworks mit zunehmender Anzahl von MPI-Ranks für Data Generation und Data Aggregation zu beurteilen, müsste man typischerweise auf spezifische Leistungsmetriken und Testergebnisse schauen, die in der Regel in wissenschaftlichen Arbeiten oder technischen Berichten präsentiert werden. 

Im Allgemeinen könnte man erwarten, dass mit einer steigenden Anzahl von MPI-Ranks die Performance in Bezug auf die Datenverarbeitung und -aggregation zunächst verbessert wird, da mehr Rechenressourcen zur Verfügung stehen. Dies führt zu einer besseren Parallelisierung und schnelleren Verarbeitung. Allerdings gibt es oft einen Punkt, an dem die Skalierungseffekte abnehmen oder sogar negativ werden können. Dies kann durch Faktoren wie Kommunikations-Overhead, Lastungleichgewicht oder begrenzte Bandbreite verursacht werden.

Ohne spezifische Daten oder Ergebnisse aus dem Kontext kann man jedoch keine detaillierte Aussage treffen. Es wäre wichtig, die tatsächlichen Skalierungstests und deren Ergebnisse zu betrachten, um eine fundierte Aussage über die Performance-Skalierung zu machen.","Das Framework zeigt eine positive Skalierung mit zunehmender Anzahl von MPI-Ranks, wobei sowohl die Data Generation als auch die Data Aggregation Phase eine Verringerung der Ausführungszeit bei steigender Rank-Anzahl aufweisen. Figure 1(c) demonstriert, dass sich die Zeiten für beide Phasen mit mehr MPI-Ranks reduzieren, was beweist, dass die Pipeline skalierbar ist und große Datenmengen effizient verarbeiten kann. Diese Skalierbarkeit wird durch die verteilte Architektur ermöglicht, die die Arbeitslast gleichmäßig auf alle verfügbaren Ranks verteilt und Bottlenecks vermeidet.",0.1888111888111888,0.35064935064935066,0.24545454545454545,0.035211267605633804,0.06578947368421052,0.045871559633027525
P5_Q1,"Wie wird das Defence-in-Depth-Modell konkret strukturiert und welche spezifischen Überschneidungen bestehen zwischen den drei Hauptbereichen Risk Assessment, Development und Control?","Das Defence-in-Depth-Modell ist ein Sicherheitskonzept, das darauf abzielt, mehrere Schichten von Verteidigungsmaßnahmen zu implementieren, um Risiken zu minimieren und die Sicherheit zu erhöhen. Es wird typischerweise in Bereichen wie IT-Sicherheit, Nuklearsicherheit und anderen sicherheitskritischen Bereichen angewendet.

Die Strukturierung des Defence-in-Depth-Modells umfasst in der Regel die folgenden Hauptbereiche:

1. **Risk Assessment (Risikobewertung):** Dieser Bereich konzentriert sich auf die Identifizierung, Analyse und Bewertung von Risiken. Ziel ist es, potenzielle Bedrohungen und Schwachstellen zu erkennen und deren potenzielle Auswirkungen zu verstehen. Dies bildet die Grundlage für die Entwicklung von Sicherheitsstrategien.

2. **Development (Entwicklung):** In diesem Bereich werden Sicherheitsmaßnahmen und -strategien entwickelt und implementiert. Dies umfasst die Gestaltung von Systemen und Prozessen, die robust gegenüber identifizierten Risiken sind. Hierbei werden Sicherheitsanforderungen in die Design- und Entwicklungsprozesse integriert.

3. **Control (Kontrolle):** Dieser Bereich bezieht sich auf die Überwachung und Kontrolle der implementierten Sicherheitsmaßnahmen. Es werden Mechanismen zur Detektion von Sicherheitsvorfällen und zur Reaktion darauf eingerichtet. Zudem werden regelmäßige Überprüfungen und Tests durchgeführt, um die Wirksamkeit der Sicherheitsmaßnahmen sicherzustellen.

**Spezifische Überschneidungen zwischen den drei Hauptbereichen:**

- **Zwischen Risk Assessment und Development:** Die Ergebnisse der Risikobewertung fließen direkt in die Entwicklungsphase ein, um sicherzustellen, dass die entwickelten Systeme und Prozesse den identifizierten Risiken angemessen begegnen können. Sicherheitsanforderungen werden basierend auf den Risikobewertungen spezifiziert.

- **Zwischen Development und Control:** Die in der Entwicklungsphase implementierten Sicherheitsmaßnahmen müssen kontinuierlich überwacht und kontrolliert werden. Dies stellt sicher, dass sie wie beabsichtigt funktionieren und auf neue Bedrohungen oder Schwachstellen reagieren können. Feedback aus der Kontrollphase kann zu Anpassungen und Verbesserungen in der Entwicklung führen.

- **Zwischen Control und Risk Assessment:** Die Kontrolle liefert Daten und Erkenntnisse, die in die Risikobewertung einfließen können. Neue Bedrohungen oder Schwachstellen, die während der Überwachung entdeckt werden, können eine Neubewertung der Risiken erforderlich machen.

Insgesamt sorgt das Defence-in-Depth-Modell durch diese Überschneidungen und die enge Verzahnung der Bereiche dafür, dass Sicherheitsmaßnahmen umfassend und anpassungsfähig sind.","Das Defence-in-Depth-Modell strukturiert die AI Safety Forschung in drei Hauptbereiche: Risk Assessment (Bewertung der Schwere und Wahrscheinlichkeit potenzieller Schäden), Development (Entwicklung vertrauenswürdiger, zuverlässiger und sicherer Systeme) und Control (Überwachung und Intervention nach der Bereitstellung). Die spezifischen Überschneidungen werden in Figure 1 als Venn-Diagramm illustriert: Zwischen Assessment und Development liegt Specification, validation, assurance, zwischen Assessment und Control Real-time monitoring, zwischen Development und Control E.g. jailbreak refusal, und im Zentrum aller drei Bereiche befinden sich grundlegende Sicherheitstechniken. Diese Überschneidungen entstehen durch unterschiedliche Definitionen dessen, was als Teil des Systems versus als kontrollierende Feedback-Schleifen betrachtet wird.",0.10097719869706841,0.3333333333333333,0.15500000000000003,0.013071895424836602,0.043478260869565216,0.020100502512562814
P5_Q2,"Welche acht Personen bildeten das Expert Planning Committee und aus welchen Institutionen stammten sie, und wie gestaltete sich der mehrstufige Feedback-Prozess zur Konsensbildung?","Um die Frage zu beantworten, benötige ich spezifische Informationen aus dem bereitgestellten Kontext, die die Namen der acht Personen im Expert Planning Committee, ihre jeweiligen Institutionen und Details zum mehrstufigen Feedback-Prozess zur Konsensbildung enthalten. Da der Kontext nicht bereitgestellt wurde, kann ich diese Informationen nicht direkt liefern. Bitte geben Sie den relevanten Kontext an, damit ich Ihnen weiterhelfen kann.","Das Expert Planning Committee bestand aus acht Personen: Dawn Song (UC Berkeley), Lan Xue (Tsinghua University), Luke Ong (Nanyang Technological University), Max Tegmark (MIT), Stuart Russell (UC Berkeley), Tegan Maharaj (MILA), Ya-Qin Zhang (Tsinghua University) und Yoshua Bengio (MILA). Der mehrstufige Feedback-Prozess gestaltete sich folgendermaßen: Zunächst erstellte das Committee einen Konsultationsentwurf, der an alle Konferenzteilnehmer verteilt wurde, um umfassendes Feedback einzuholen. Nach mehreren Runden von schriftlichen und persönlichen Rückmeldungen der Teilnehmer wurde das Dokument überarbeitet, um Punkte des breiten Konsenses unter den diversen Forschern zu synthetisieren.",0.1864406779661017,0.12790697674418605,0.15172413793103448,0.017241379310344827,0.011764705882352941,0.013986013986013986
P5_Q3,Was sind 'Areas of mutual interest' im Kontext der AI Safety Forschung und welche konkreten Beispiele werden für potentiell kooperative Forschungsbereiche genannt?,"Im Kontext der AI Safety Forschung beziehen sich ""Areas of mutual interest"" auf Forschungsbereiche, in denen sowohl die Entwickler von KI-Systemen als auch die Sicherheitsforscher gemeinsame Interessen haben. Diese Bereiche bieten Potenzial für Zusammenarbeit, da sie sowohl die Leistungsfähigkeit von KI-Systemen verbessern als auch deren Sicherheit gewährleisten können.

Konkrete Beispiele für solche potentiell kooperativen Forschungsbereiche könnten sein:

1. **Robustheit von KI-Systemen**: Forschung, die darauf abzielt, KI-Systeme widerstandsfähiger gegen Fehler und Angriffe zu machen, ist sowohl für die Leistungsfähigkeit als auch für die Sicherheit von Interesse.

2. **Transparenz und Erklärbarkeit**: Die Entwicklung von Methoden, die es ermöglichen, die Entscheidungen von KI-Systemen besser zu verstehen und zu erklären, ist wichtig, um Vertrauen in diese Systeme zu schaffen und gleichzeitig ihre Sicherheit zu gewährleisten.

3. **Fairness und Bias-Reduktion**: Die Arbeit an der Reduzierung von Verzerrungen in KI-Systemen kann sowohl die ethische Akzeptanz als auch die Zuverlässigkeit und Sicherheit dieser Systeme verbessern.

4. **Verifikation und Validierung**: Techniken zur formalen Verifikation und Validierung von KI-Systemen können sicherstellen, dass diese Systeme wie beabsichtigt funktionieren und keine unerwünschten Verhaltensweisen zeigen.

Diese Bereiche sind Beispiele dafür, wie Sicherheitsforschung und die Entwicklung leistungsfähiger KI-Systeme Hand in Hand gehen können, um sowohl die Effizienz als auch die Sicherheit von KI-Technologien zu verbessern.","Areas of mutual interest bezeichnen Forschungsbereiche, bei denen verschiedene Akteure (Unternehmen, Länder) trotz Konkurrenz gemeinsame Interessen haben und Anreize bestehen, Informationen und Forschungsergebnisse zu teilen. Das Paper gibt konkrete Beispiele: bestimmte Verifikationsmechanismen, Risikomanagement-Standards und Risikobewertungen, da diese minimalen Wettbewerbsvorteil bieten, aber einem gemeinsamen Interesse dienen. Ähnlich wie konkurrierende Flugzeughersteller (Boeing und Airbus) bei Flugsicherheitsinformationen und -standards kooperieren, könnten AI-Akteure bei der Zusammenarbeit profitieren, da niemand von AI-Zwischenfällen oder der Ermächtigung böswilliger Akteure profitiert.",0.09405940594059406,0.2602739726027397,0.13818181818181816,0.009950248756218905,0.027777777777777776,0.014652014652014654
P5_Q4,Welche spezifischen Definitionen werden für die Begriffe 'Artificial General Intelligence (AGI)' und 'Artificial Superintelligence (ASI)' im Glossar gegeben?,"Um die spezifischen Definitionen für 'Artificial General Intelligence (AGI)' und 'Artificial Superintelligence (ASI)' zu geben, benötige ich den Inhalt des Glossars, auf das sich die Frage bezieht. Da ich diesen Inhalt nicht habe, kann ich allgemeine Definitionen geben:

- **Artificial General Intelligence (AGI)**: AGI bezieht sich auf eine Form von künstlicher Intelligenz, die in der Lage ist, jede intellektuelle Aufgabe zu verstehen, zu lernen und auszuführen, die ein Mensch bewältigen kann. AGI ist nicht auf spezifische Aufgaben beschränkt und hat die Fähigkeit zur allgemeinen Problemlösung und zum Lernen in verschiedenen Domänen.

- **Artificial Superintelligence (ASI)**: ASI beschreibt eine Form von künstlicher Intelligenz, die die kognitiven Fähigkeiten des Menschen in allen Bereichen übertrifft. Eine ASI wäre in der Lage, komplexe Probleme zu lösen, kreative Aufgaben zu bewältigen und Entscheidungen zu treffen, die weit über das menschliche Verständnis hinausgehen.

Wenn du die spezifischen Definitionen aus einem bestimmten Glossar benötigst, müsstest du mir den entsprechenden Text oder die Definitionen bereitstellen.","Das Glossar definiert Artificial General Intelligence (AGI) als AI that can do most cognitive work as well as humans. This implies that it is highly autonomous and can do most economically valuable remote work as well as humans. Artificial Superintelligence (ASI) wird definiert als AI that can accomplish any cognitive work far beyond human level. Zusätzlich wird AGI in Figure 2 als Schnittmenge von drei Eigenschaften dargestellt: Autonomy (A), Generality (G) und Intelligence (I), wobei Systeme mit allen drei Eigenschaften am schwierigsten zu kontrollieren sind.",0.07006369426751592,0.12941176470588237,0.09090909090909091,0.00641025641025641,0.011904761904761904,0.008333333333333333
