question_id,question_string,answer_llm,answer_gold
P3_Q5,"Wie wurde die Hardware-aware Optimierung implementiert, insbesondere die dynamische Anpassung von k_max basierend auf L3-Cache und Thread Count?","Um die Hardware-aware Optimierung zu implementieren, insbesondere die dynamische Anpassung von \( k_{\text{max}} \) basierend auf dem L3-Cache und der Anzahl der Threads, wird typischerweise ein Ansatz gewählt, der die spezifischen Hardware-Ressourcen des Systems berücksichtigt. 

1. **L3-Cache-Berücksichtigung**: Der L3-Cache ist ein gemeinsamer Cache, der von allen Kernen einer CPU genutzt wird. Um die Nutzung des L3-Caches zu optimieren, wird \( k_{\text{max}} \) so eingestellt, dass die Daten, die während der Berechnung benötigt werden, möglichst vollständig in den L3-Cache passen. Dies minimiert Cache-Misses und verbessert die Leistung. Die Größe des L3-Caches wird dabei als eine der Hauptdeterminanten für die Wahl von \( k_{\text{max}} \) verwendet.

2. **Anzahl der Threads**: Die Anzahl der verfügbaren Threads beeinflusst, wie die Berechnungen parallelisiert werden können. Eine dynamische Anpassung von \( k_{\text{max}} \) kann sicherstellen, dass die Arbeitslast gleichmäßig auf alle verfügbaren Threads verteilt wird, um eine maximale Parallelität zu erreichen. Dies kann durch eine Aufteilung der Aufgaben in kleinere Blöcke geschehen, die effizient von den Threads verarbeitet werden können.

In der Praxis könnte dies durch eine initiale Kalibrierungsphase geschehen, in der das System seine Hardware-Ressourcen analysiert und entsprechende Parameter für \( k_{\text{max}} \) festlegt. Diese Parameter können dann während der Laufzeit dynamisch angepasst werden, um auf Veränderungen in der Arbeitslast oder der Systemkonfiguration zu reagieren.","Die Hardware-aware Optimierung implementiert eine dynamische Anpassung von kmax basierend auf Systemressourcen gemäß der Formel kmax = (L3 Cache)/(4 × Thread Count). Diese Implementierung gewährleistet Thread-Parallelismus bei gleichzeitig speichereffizienter Cache-Nutzung und resultierte in einer 12% Erhöhung der Cache-Auslastung verglichen mit statischen Ansätzen. Das System aktiviert konditionale Parallelisierung nur wenn vorteilhaft: Radix Sort zeigt besonders effektive Skalierung mit 1.79× Speedup für Datensätze > 10⁶ Elemente trotz 12% Thread-Management-Overhead, während Quicksort aufgrund signifikanter Synchronisationskosten (47% Overhead) limitierte Parallelisierbarkeit (1.12× Speedup) aufweist."
P4_Q1,Welche spezifischen CUPTI-Tabellen wurden analysiert und wie viele Entitäten enthielt jede Tabelle nach dem Left-Join?,"Um die Frage zu beantworten, welche spezifischen CUPTI-Tabellen analysiert wurden und wie viele Entitäten jede Tabelle nach dem Left-Join enthielt, benötige ich mehr Informationen aus dem Kontext, den Sie bereitgestellt haben. Der Kontext, den Sie angegeben haben, enthält keine Details zu den spezifischen CUPTI-Tabellen oder die Anzahl der Entitäten nach einem Left-Join. Bitte stellen Sie den relevanten Kontext bereit, damit ich Ihnen eine genaue Antwort geben kann.","Laut Tabelle 1 wurden drei spezifische CUPTI-Tabellen analysiert: KERNEL (CUPTI_ACTIVITY_KIND_KERNEL) mit 842.054 Entitäten für alle Ranks, MEMCPY (CUPTI_ACTIVITY_KIND_MEMCPY) mit variierenden Entitäten pro Rank (107.045 für Rank 0, 107.099 für Rank 1, 1.070.545 für Rank 2, und 107.045 für Rank 3), sowie GPU (TARGET_INFO_GPU) mit 4 Entitäten für alle Ranks. Nach dem Left-Join-Prozess ergaben sich approximativ 93 Millionen Entitäten, die zur weiteren Analyse verwendet wurden."
P4_Q2,Warum entschieden sich die Autoren für Block Partitioning statt Cyclic Partitioning bei der Verteilung der Shards auf MPI-Ranks?,"Ohne den spezifischen Kontext oder die Details der Autoren zu kennen, kann ich einige allgemeine Gründe nennen, warum sich Autoren für Block Partitioning statt Cyclic Partitioning bei der Verteilung von Shards auf MPI-Ranks entscheiden könnten:

1. **Datenlokalität**: Block Partitioning kann die Datenlokalität verbessern, da zusammenhängende Datenblöcke auf demselben MPI-Rank gespeichert werden. Dies kann die Effizienz von Speicherzugriffen und die Nutzung von Cache verbessern.

2. **Kommunikationsaufwand**: Bei Block Partitioning ist der Kommunikationsaufwand zwischen den MPI-Ranks oft geringer, da weniger Daten zwischen den Ranks ausgetauscht werden müssen, im Vergleich zu Cyclic Partitioning, wo Daten häufiger zwischen Ranks verschoben werden müssen.

3. **Einfachere Implementierung**: Block Partitioning kann einfacher zu implementieren und zu verwalten sein, da die Daten in größeren, zusammenhängenden Blöcken verteilt werden, was die Verwaltung der Datenverteilung erleichtert.

4. **Lastverteilung**: In einigen Fällen kann Block Partitioning eine gleichmäßigere Lastverteilung ermöglichen, insbesondere wenn die Datenverarbeitung innerhalb der Blöcke gleichmäßig ist.

Es ist jedoch wichtig zu beachten, dass die Wahl zwischen Block und Cyclic Partitioning stark von der spezifischen Anwendung und den zugrunde liegenden Daten abhängt. Cyclic Partitioning kann in Szenarien vorteilhaft sein, in denen eine gleichmäßigere Verteilung der Arbeitslast über die Ranks hinweg erforderlich ist, insbesondere wenn die Datenverarbeitung ungleichmäßig ist.","Die Autoren entschieden sich für Block Partitioning über Cyclic Partitioning, da der Datensatz statisch ist und eine hohe Workload-Vorhersagbarkeit aufweist. Block Partitioning weist zusammenhängende Shards jedem Rank zu, was den Query-Overhead reduziert, die Datenlokalität verbessert und eine effiziente SQL-Query-Ausführung ermöglicht. Diese Methode ist besonders vorteilhaft für statische Datensätze, da sie die Kommunikationskosten zwischen den Ranks minimiert und die Cache-Effizienz maximiert."
P4_Q3,Welche Methode wurde zur Identifikation der Top-5 anomalous shards verwendet und wie funktioniert diese?,"Um die Frage zu beantworten, benötige ich spezifische Informationen aus dem bereitgestellten Kontext, da dieser nicht in Ihrer Anfrage enthalten ist. Bitte geben Sie den relevanten Teil des Kontextes an, der die Methode zur Identifikation der Top-5 anomalous shards beschreibt, damit ich Ihnen eine präzise Antwort geben kann.","Zur Identifikation der Top-5 anomalous Shards verwendeten die Autoren die Inter-Quartile Range (IQR) Methode. Diese statistische Methode berechnet zunächst gemeinsame Statistiken (Minimum, Maximum, Standardabweichung) kollaborativ über alle P Ranks in einem Round-Robin-Verfahren. Anschließend werden diese gemeinsamen Statistiken verwendet, um Anomalien zu identifizieren, wobei die IQR-Methode Ausreißer basierend auf der Verteilung der Daten innerhalb der Quartile bestimmt und die fünf auffälligsten Shards zur detaillierten Analyse auswählt."
P4_Q4,Was zeigt die Analyse der Memory Stall Duration für Rank 2 bezüglich der Device-to-Host und Host-to-Device Transfers?,"Um die Frage zu beantworten, müsste ich spezifische Informationen aus der Analyse der Memory Stall Duration für Rank 2 haben, die sich auf die Transfers von Device-to-Host und Host-to-Device beziehen. Da diese Informationen im bereitgestellten Kontext nicht enthalten sind, kann ich keine genaue Antwort geben. 

Im Allgemeinen bezieht sich die ""Memory Stall Duration"" auf die Zeit, in der ein Prozessor oder eine GPU auf Daten aus dem Speicher wartet, was die Leistung beeinflussen kann. Eine Analyse könnte zeigen, ob es Engpässe oder Verzögerungen bei den Datenübertragungen zwischen dem Gerät und dem Host gibt, was auf Optimierungsmöglichkeiten hinweisen könnte. Wenn Sie spezifische Details oder Ergebnisse aus der Analyse haben, kann ich Ihnen helfen, diese zu interpretieren.","Die Analyse der Memory Stall Duration für Rank 2 ergab, dass Device-to-Host und Host-to-Device Transfers dominieren, was auf häufige Ping-Pong-Muster hindeutet, die durch ineffiziente Batch-Verarbeitung verursacht werden. Im Gegensatz dazu zeigen spärliche Device-to-Device Transfers seltene Intra-GPU-Operationen an, was Optimierungsmöglichkeiten durch Shared Memory Reuse oder Tiling-Strategien aufzeigt. Diese Erkenntnisse deuten darauf hin, dass die Datenübertragungseffizienz zwischen Host und Device ein kritischer Engpass für die Performance darstellt."
P4_Q5,Wie skaliert die Performance des Frameworks mit zunehmender Anzahl von MPI-Ranks für Data Generation und Data Aggregation?,"Um die Skalierung der Performance des Frameworks mit zunehmender Anzahl von MPI-Ranks für Data Generation und Data Aggregation zu beurteilen, müsste man typischerweise die Effizienz und Geschwindigkeit der Datenverarbeitung bei steigender Anzahl von Prozessen (MPI-Ranks) betrachten. 

In der Regel erwartet man, dass die Performance bei einer Erhöhung der Anzahl von MPI-Ranks bis zu einem gewissen Punkt linear oder nahezu linear skaliert, was bedeutet, dass die Daten schneller generiert und aggregiert werden können, da die Arbeitslast auf mehr Prozesse verteilt wird. 

Allerdings kann es ab einem bestimmten Punkt zu einer Abnahme der Skalierungseffizienz kommen. Dies kann durch Faktoren wie Kommunikations-Overhead zwischen den Ranks, ungleichmäßige Lastverteilung oder Ressourcenbeschränkungen verursacht werden. 

Für eine genaue Bewertung wäre es notwendig, spezifische Messungen oder Benchmarks des Frameworks durchzuführen, um zu sehen, wie sich die Performance tatsächlich mit der Anzahl der MPI-Ranks verändert.","Das Framework zeigt eine positive Skalierung mit zunehmender Anzahl von MPI-Ranks, wobei sowohl die Data Generation als auch die Data Aggregation Phase eine Verringerung der Ausführungszeit bei steigender Rank-Anzahl aufweisen. Figure 1(c) demonstriert, dass sich die Zeiten für beide Phasen mit mehr MPI-Ranks reduzieren, was beweist, dass die Pipeline skalierbar ist und große Datenmengen effizient verarbeiten kann. Diese Skalierbarkeit wird durch die verteilte Architektur ermöglicht, die die Arbeitslast gleichmäßig auf alle verfügbaren Ranks verteilt und Bottlenecks vermeidet."
P5_Q1,"Wie wird das Defence-in-Depth-Modell konkret strukturiert und welche spezifischen Überschneidungen bestehen zwischen den drei Hauptbereichen Risk Assessment, Development und Control?","Das Defence-in-Depth-Modell ist ein Sicherheitsansatz, der darauf abzielt, mehrere Schutzebenen zu schaffen, um Risiken zu minimieren und die Sicherheit zu erhöhen. Es wird häufig in Bereichen wie IT-Sicherheit, Nuklearsicherheit und anderen sicherheitskritischen Bereichen angewendet. Das Modell ist typischerweise in drei Hauptbereiche strukturiert: Risk Assessment, Development und Control.

1. **Risk Assessment (Risikobewertung):** Dieser Bereich konzentriert sich auf die Identifizierung und Bewertung von Risiken. Es werden potenzielle Bedrohungen und Schwachstellen analysiert, um das Risiko für das System oder die Organisation zu verstehen. Überschneidungen mit den anderen Bereichen können in der Form von Feedback-Schleifen bestehen, bei denen die Ergebnisse der Risikobewertung die Entwicklung und Kontrolle beeinflussen.

2. **Development (Entwicklung):** In diesem Bereich werden Sicherheitsmaßnahmen und -protokolle entwickelt und implementiert. Die Entwicklung umfasst das Design und die Implementierung von Sicherheitsarchitekturen und -lösungen. Überschneidungen mit Risk Assessment bestehen darin, dass die Entwicklung auf den identifizierten Risiken basiert, während Überschneidungen mit Control darin bestehen, dass die entwickelten Lösungen regelmäßig überprüft und angepasst werden müssen.

3. **Control (Kontrolle):** Dieser Bereich umfasst die Überwachung und Prüfung der implementierten Sicherheitsmaßnahmen, um sicherzustellen, dass sie effektiv sind. Kontrolle beinhaltet auch die Durchführung von Audits und Tests, um die Einhaltung der Sicherheitsstandards zu gewährleisten. Überschneidungen mit Risk Assessment bestehen darin, dass die Kontrolle neue Risiken identifizieren kann, während Überschneidungen mit Development darin bestehen, dass die Ergebnisse der Kontrolle zu Anpassungen und Verbesserungen in der Entwicklung führen können.

Die spezifischen Überschneidungen zwischen diesen Bereichen sind entscheidend für die Effektivität des Defence-in-Depth-Modells. Eine kontinuierliche Interaktion und Rückkopplung zwischen Risk Assessment, Development und Control stellt sicher, dass Sicherheitsmaßnahmen aktuell und effektiv bleiben.","Das Defence-in-Depth-Modell strukturiert die AI Safety Forschung in drei Hauptbereiche: Risk Assessment (Bewertung der Schwere und Wahrscheinlichkeit potenzieller Schäden), Development (Entwicklung vertrauenswürdiger, zuverlässiger und sicherer Systeme) und Control (Überwachung und Intervention nach der Bereitstellung). Die spezifischen Überschneidungen werden in Figure 1 als Venn-Diagramm illustriert: Zwischen Assessment und Development liegt Specification, validation, assurance, zwischen Assessment und Control Real-time monitoring, zwischen Development und Control E.g. jailbreak refusal, und im Zentrum aller drei Bereiche befinden sich grundlegende Sicherheitstechniken. Diese Überschneidungen entstehen durch unterschiedliche Definitionen dessen, was als Teil des Systems versus als kontrollierende Feedback-Schleifen betrachtet wird."
P5_Q2,"Welche acht Personen bildeten das Expert Planning Committee und aus welchen Institutionen stammten sie, und wie gestaltete sich der mehrstufige Feedback-Prozess zur Konsensbildung?","Es tut mir leid, aber die bereitgestellte Information enthält keine Details über die Mitglieder des Expert Planning Committee oder deren institutionelle Zugehörigkeiten. Ebenso fehlen Informationen über den mehrstufigen Feedback-Prozess zur Konsensbildung. Wenn Sie weitere Informationen oder einen anderen Kontext haben, kann ich Ihnen möglicherweise besser helfen.","Das Expert Planning Committee bestand aus acht Personen: Dawn Song (UC Berkeley), Lan Xue (Tsinghua University), Luke Ong (Nanyang Technological University), Max Tegmark (MIT), Stuart Russell (UC Berkeley), Tegan Maharaj (MILA), Ya-Qin Zhang (Tsinghua University) und Yoshua Bengio (MILA). Der mehrstufige Feedback-Prozess gestaltete sich folgendermaßen: Zunächst erstellte das Committee einen Konsultationsentwurf, der an alle Konferenzteilnehmer verteilt wurde, um umfassendes Feedback einzuholen. Nach mehreren Runden von schriftlichen und persönlichen Rückmeldungen der Teilnehmer wurde das Dokument überarbeitet, um Punkte des breiten Konsenses unter den diversen Forschern zu synthetisieren."
P5_Q3,Was sind 'Areas of mutual interest' im Kontext der AI Safety Forschung und welche konkreten Beispiele werden für potentiell kooperative Forschungsbereiche genannt?,"Im Kontext der AI Safety Forschung beziehen sich ""Areas of mutual interest"" auf Forschungsbereiche, in denen sowohl die Entwickler von KI-Systemen als auch die Sicherheitsforscher gemeinsame Interessen haben. Diese Bereiche bieten Möglichkeiten zur Zusammenarbeit, um sicherzustellen, dass KI-Systeme sicher und zuverlässig sind. Konkrete Beispiele für solche potentiell kooperativen Forschungsbereiche könnten die Entwicklung von robusten KI-Modellen, die Verbesserung der Interpretierbarkeit von KI-Systemen, die Erforschung von Mechanismen zur Vermeidung von Fehlverhalten in KI-Systemen und die Entwicklung von Standards und Protokollen für die sichere Implementierung von KI-Technologien sein.","Areas of mutual interest bezeichnen Forschungsbereiche, bei denen verschiedene Akteure (Unternehmen, Länder) trotz Konkurrenz gemeinsame Interessen haben und Anreize bestehen, Informationen und Forschungsergebnisse zu teilen. Das Paper gibt konkrete Beispiele: bestimmte Verifikationsmechanismen, Risikomanagement-Standards und Risikobewertungen, da diese minimalen Wettbewerbsvorteil bieten, aber einem gemeinsamen Interesse dienen. Ähnlich wie konkurrierende Flugzeughersteller (Boeing und Airbus) bei Flugsicherheitsinformationen und -standards kooperieren, könnten AI-Akteure bei der Zusammenarbeit profitieren, da niemand von AI-Zwischenfällen oder der Ermächtigung böswilliger Akteure profitiert."
P5_Q4,Welche spezifischen Definitionen werden für die Begriffe 'Artificial General Intelligence (AGI)' und 'Artificial Superintelligence (ASI)' im Glossar gegeben?,"Um die spezifischen Definitionen für die Begriffe 'Artificial General Intelligence (AGI)' und 'Artificial Superintelligence (ASI)' im Glossar zu beantworten, benötige ich den Inhalt des Glossars, auf den sich die Frage bezieht. Da der Kontext nicht bereitgestellt wurde, kann ich allgemeine Definitionen geben:

- **Artificial General Intelligence (AGI)**: AGI bezieht sich auf eine Form von künstlicher Intelligenz, die in der Lage ist, jede intellektuelle Aufgabe zu verstehen, zu lernen und auszuführen, die ein Mensch bewältigen kann. AGI ist nicht auf spezifische Aufgaben beschränkt und besitzt die Fähigkeit zur allgemeinen Problemlösung und zum Lernen in verschiedenen Domänen.

- **Artificial Superintelligence (ASI)**: ASI beschreibt eine Form von künstlicher Intelligenz, die die kognitiven Fähigkeiten des Menschen in allen Bereichen übertrifft. Eine ASI wäre in der Lage, komplexe Probleme zu lösen, kreative Aufgaben zu bewältigen und in Bereichen zu operieren, die weit über das menschliche Verständnis hinausgehen.

Wenn Sie die spezifischen Definitionen aus einem bestimmten Glossar benötigen, wäre es hilfreich, den entsprechenden Text oder die Quelle bereitzustellen.","Das Glossar definiert Artificial General Intelligence (AGI) als AI that can do most cognitive work as well as humans. This implies that it is highly autonomous and can do most economically valuable remote work as well as humans. Artificial Superintelligence (ASI) wird definiert als AI that can accomplish any cognitive work far beyond human level. Zusätzlich wird AGI in Figure 2 als Schnittmenge von drei Eigenschaften dargestellt: Autonomy (A), Generality (G) und Intelligence (I), wobei Systeme mit allen drei Eigenschaften am schwierigsten zu kontrollieren sind."
P5_Q5,Wie wird Ashby's Law of Requisite Variety im Kontext der AI-Kontrolle erklärt und welche Implikationen ergeben sich daraus für Human-centric Oversight?,"Ashby's Law of Requisite Variety, auch bekannt als das Gesetz der erforderlichen Vielfalt, besagt, dass die Kontrolle eines Systems nur dann effektiv sein kann, wenn der Kontrollmechanismus mindestens so viel Vielfalt oder Flexibilität aufweist wie das System selbst. Im Kontext der AI-Kontrolle bedeutet dies, dass die Kontrollmechanismen, die zur Überwachung und Steuerung von KI-Systemen eingesetzt werden, in der Lage sein müssen, die Komplexität und Vielfalt der möglichen Zustände und Verhaltensweisen dieser Systeme abzudecken.

Im Hinblick auf Human-centric Oversight hat Ashby's Gesetz wichtige Implikationen. Es legt nahe, dass menschliche Aufsichtsgremien oder Kontrollinstanzen, die für die Überwachung von KI-Systemen verantwortlich sind, über ausreichende Kenntnisse, Fähigkeiten und Werkzeuge verfügen müssen, um die Vielfalt der möglichen Szenarien, die durch KI-Systeme entstehen können, zu verstehen und zu steuern. Dies könnte bedeuten, dass Menschen, die in der KI-Kontrolle tätig sind, umfassend geschult werden müssen und Zugang zu fortschrittlichen Technologien und Methoden haben sollten, um effektiv zu arbeiten.

Darüber hinaus impliziert das Gesetz, dass es notwendig sein könnte, adaptive und dynamische Kontrollmechanismen zu entwickeln, die sich an die sich ändernden Bedingungen und Herausforderungen anpassen können, die durch KI-Systeme entstehen. Dies könnte die Entwicklung von KI-gestützten Kontrollsystemen umfassen, die in der Lage sind, mit der Komplexität der zu überwachenden KI-Systeme Schritt zu halten.

Insgesamt unterstreicht Ashby's Law of Requisite Variety die Notwendigkeit einer sorgfältig gestalteten und gut ausgestatteten menschlichen Aufsicht, um sicherzustellen, dass KI-Systeme sicher und verantwortungsvoll eingesetzt werden.","Ashby's Law of Requisite Variety besagt, dass für Sicherheitsgarantien ein Kontrollsystem generell mindestens so viel Komplexität haben muss wie das System, das es zu kontrollieren versucht. Im Kontext von Human-centric Oversight bedeutet dies, dass es natürliche Grenzen für die Kontrollierbarkeit von Systemen gibt, basierend auf Denkgeschwindigkeit, Proaktivität, Expertisegrad, Aufmerksamkeit für Details und Zuverlässigkeit menschlicher Operatoren. Selbst mit AI-Assistenz, die Menschen beim Verstehen des gegebenen Kontexts unterstützen, deutet das Gesetz darauf hin, dass das kontrollierende System mindestens so viel Ausdrucksfähigkeit haben muss wie das kontrollierte System. Dies stellt eine fundamentale Herausforderung für die Überwachung hochentwickelter AI-Systeme dar."
P1_META_Q1,Wer sind die Autoren des Papers?,"Es tut mir leid, aber ohne den spezifischen Kontext oder das Paper, auf das Sie sich beziehen, kann ich die Autoren nicht benennen. Wenn Sie mir mehr Informationen über das Paper geben, wie zum Beispiel den Titel oder das Thema, kann ich Ihnen möglicherweise weiterhelfen.",Md Toufique Hasan and Muhammad Waseem and Kai-Kristian Kemell and Ayman Asad Khan and Mika Saari and Pekka Abrahamsson
P2_META_Q1,Wer sind die Autoren des Papers?,"Es tut mir leid, aber ohne den spezifischen Kontext oder das Paper, auf das Sie sich beziehen, kann ich die Autoren nicht identifizieren. Wenn Sie mir mehr Informationen über das Paper geben können, wie den Titel oder das Thema, könnte ich Ihnen möglicherweise weiterhelfen.",Gurusha Juneja and Alon Albalak and Wenyue Hua and William Yang Wang
P3_META_Q1,Wer sind die Autoren des Papers?,"Es tut mir leid, aber ohne den spezifischen Kontext oder das Paper, auf das Sie sich beziehen, kann ich die Autoren nicht benennen. Wenn Sie mir mehr Informationen über das Paper geben, wie zum Beispiel den Titel oder das Thema, könnte ich Ihnen möglicherweise weiterhelfen.",Shrinivass Arunachalam Balasubramanian
P4_META_Q1,Wer sind die Autoren des Papers?,"Es tut mir leid, aber ohne den spezifischen Kontext oder das Paper, auf das Sie sich beziehen, kann ich die Autoren nicht benennen. Wenn Sie mir mehr Informationen über das Paper geben können, wie zum Beispiel den Titel oder das Thema, könnte ich Ihnen möglicherweise besser helfen.",Ankur Lahiry and Ayush Pokharel and Seth Ockerman and Amal Gueroudji and Line Pouchard and Tanzima Z. Islam
P5_META_Q1,Wer sind die Autoren des Papers?,"Es tut mir leid, aber ohne den spezifischen Kontext oder das Paper, auf das Sie sich beziehen, kann ich die Autoren nicht identifizieren. Wenn Sie mir mehr Informationen über das Paper geben können, wie zum Beispiel den Titel oder das Thema, könnte ich Ihnen möglicherweise weiterhelfen.",Yoshua Bengio and Tegan Maharaj and Luke Ong and Stuart Russell and Dawn Song and Max Tegmark and Lan Xue and Ya-Qin Zhang and Stephen Casper and Wan Sie Lee and Sören Mindermann and Vanessa Wilfred and Vidhisha Balachandran and Fazl Barez and Michael Belinsky and Imane Bello and Malo Bourgon and Mark Brakel and Siméon Campos and Duncan Cass-Beggs and Jiahao Chen and Rumman Chowdhury and Kuan Chua Seah and Jeff Clune and Juntao Dai and Agnes Delaborde and Nouha Dziri and Francisco Eiras and Joshua Engels and Jinyu Fan and Adam Gleave and Noah Goodman and Fynn Heide and Dan Hendrycks and Cyrus Hodes and Bryan Low Kian Hsiang and Minlie Huang and Sami Jawhar and Wang Jingyu and Adam Tauman Kalai and Meindert Kamphuis and Mohan Kankanhalli and Subhash Kantamneni and Mathias Bonde Kirk and Thomas Kwa and Jeffrey Ladish and Kwok-Yan Lam and Wan Lee Sie and Taewhi Lee and Xiaojian Li and Jiajun Liu and Chaochao Lu and Yifan Mai and Richard Mallah and Julian Michael and Nick Moës and Simon Möller and Kihyuk Nam and Kwan Yee Ng and Mark Nitzberg and Besmira Nushi and Seán O hÉigeartaigh and Alejandro Ortega and Pierre Peigné and James Petrie and Benjamin Prud'Homme and Reihaneh Rabbany and Nayat Sanchez-Pi and Sarah Schwettmann and Buck Shlegeris and Saad Siddiqui and Aradhana Sinha and Martín Soto and Cheston Tan and Dong Ting and Robert Trager and Brian Tse and Anthony Tung K. H. and Vanessa Wilfred and John Willes and Denise Wong and Wei Xu and Rongwu Xu and Yi Zeng and HongJiang Zhang and Djordje Žikelić
