question_id,question_string,answer_llm,answer_gold,precision-1,recall-1,ROUGE-1,precision-2,recall-2,ROUGE-2
P1_Q1,"Welche spezifischen Herausforderungen identifizierten die Autoren beim Einsatz von OCR in den Agriculture- und Healthcare-PDFs, und welche Lösungsansätze wurden implementiert?","Um die spezifischen Herausforderungen beim Einsatz von OCR (Optical Character Recognition) in den Bereichen Landwirtschaft und Gesundheitswesen zu identifizieren, müssten wir den Kontext oder die Studie kennen, auf die sich die Frage bezieht. Allgemein gibt es jedoch einige typische Herausforderungen und Lösungsansätze, die in diesen Bereichen auftreten können:

1. **Herausforderungen:**
   - **Qualität der Dokumente:** In beiden Bereichen können die Dokumente von schlechter Qualität sein, sei es durch schlechte Scans, handschriftliche Notizen oder alte, verblasste Dokumente.
   - **Vielfalt der Dokumente:** Es gibt eine große Vielfalt an Dokumentenformaten und -strukturen, die die OCR-Erkennung erschweren können.
   - **Fachspezifische Terminologie:** Die Verwendung von Fachjargon und spezifischen Begriffen kann die Erkennungsgenauigkeit beeinträchtigen.
   - **Mehrsprachigkeit:** Dokumente können in mehreren Sprachen vorliegen, was die OCR-Verarbeitung komplexer macht.

2. **Lösungsansätze:**
   - **Vorverarbeitung der Dokumente:** Verbesserung der Bildqualität durch Filterung, Rauschunterdrückung und Kontrastanpassung.
   - **Anpassung der OCR-Modelle:** Training von OCR-Modellen auf spezifische Fachterminologie und Dokumentenarten.
   - **Einsatz von KI und maschinellem Lernen:** Verwendung von KI-Techniken zur Verbesserung der Erkennungsgenauigkeit und zur Anpassung an unterschiedliche Dokumentenstrukturen.
   - **Spracherkennungssysteme:** Integration von mehrsprachigen Erkennungssystemen, um mit der Mehrsprachigkeit umzugehen.

Ohne den spezifischen Kontext der Studie oder des Artikels, auf den sich die Frage bezieht, sind dies allgemeine Herausforderungen und Lösungsansätze, die in der Literatur häufig diskutiert werden.","Die Autoren identifizierten noisy OCR-Output als Hauptherausforderung, der die FAISS-Qualität in Agriculture- und Healthcare-PDFs erheblich degradierte und die Retrieval-Genauigkeit limitierte. Als Lösungsansätze implementierten sie eine Kombination aus TesseractOCR und easyOCR als alternative OCR-Engines, ergänzt durch regex-basierte Cleanup-Verfahren zur systematischen Nachbearbeitung des extrahierten Texts. Zusätzlich integrierten sie PyMuPDF für die Extraktion sowohl text-basierter als auch bild-basierter Inhalte und führten systematische Datenbereinigungsverfahren ein, die die Entfernung von OCR-Rauschen und Duplikaten zur Verbesserung der Retrieval-Qualität ohne Modifikation der Modelle ermöglichten.",0.1073170731707317,0.2857142857142857,0.15602836879432624,0.014705882352941176,0.039473684210526314,0.02142857142857143
P1_Q2,"Wie unterscheidet sich die Systemarchitektur zwischen dem Disarm RAG und den anderen vier implementierten Systemen, insbesondere hinsichtlich der Datenschutzanforderungen?","Um die Unterschiede in der Systemarchitektur zwischen dem Disarm RAG und den anderen vier implementierten Systemen zu verstehen, insbesondere in Bezug auf die Datenschutzanforderungen, müssen wir die spezifischen Merkmale und Ansätze jedes Systems betrachten. 

Disarm RAG könnte sich durch eine Architektur auszeichnen, die speziell auf die Minimierung der Datenspeicherung und die Maximierung der Datensicherheit ausgelegt ist. Dies könnte durch die Implementierung von Techniken wie Datenanonymisierung, Verschlüsselung und der Verwendung von dezentralen Datenbanken erreicht werden. Solche Maßnahmen würden sicherstellen, dass personenbezogene Daten besser geschützt sind und die Datenschutzanforderungen strenger eingehalten werden.

Im Vergleich dazu könnten die anderen vier Systeme unterschiedliche Ansätze verfolgen, die möglicherweise weniger strenge Datenschutzmaßnahmen beinhalten. Diese Systeme könnten beispielsweise zentralisierte Datenbanken verwenden, die anfälliger für Datenschutzverletzungen sind, oder sie könnten mehr personenbezogene Daten sammeln und speichern, was das Risiko für den Datenschutz erhöht.

Zusammenfassend lässt sich sagen, dass der Hauptunterschied in der Systemarchitektur zwischen Disarm RAG und den anderen Systemen in der Art und Weise liegt, wie sie Datenschutzanforderungen adressieren, wobei Disarm RAG möglicherweise einen stärkeren Fokus auf den Schutz und die Minimierung der Nutzung personenbezogener Daten legt.","Das Disarm RAG-System unterscheidet sich fundamental von den anderen vier Systemen durch seine sicherheitsorientierte Architektur und Datenschutzanforderungen. Es wird auf einem sicheren Server bei CSC (Finnish IT Center for Science) gehostet, um vollständige Datenprivatsphäre zu gewährleisten, und verwendet LLaMA 2-uncensored via Ollama für offenen Zugang zu Cybersecurity-Wissen. Der entscheidende Unterschied liegt darin, dass Disarm RAG bewusst auf Quellzitationen verzichtet, während alle anderen Systeme Quellenreferenzen zur Transparenz anzeigen - diese Ausnahme erfolgt aufgrund der Sensitivität von Cybersecurity-Inhalten, um sensitive Materialien zu schützen und gleichzeitig GDPR-Risiken zu reduzieren.",0.12777777777777777,0.26744186046511625,0.17293233082706766,0.01675977653631285,0.03529411764705882,0.02272727272727273
P1_Q3,"Welche konkreten Metriken und Bewertungsdimensionen wurden in der Web-basierten Nutzerstudie mit 100 Teilnehmern verwendet, und was waren die Haupterkenntnisse?","Um die Frage zu beantworten, benötige ich spezifische Informationen aus der bereitgestellten Kontextbeschreibung, die in Ihrer Anfrage nicht enthalten ist. Bitte geben Sie die relevanten Details oder den Kontext an, damit ich Ihnen eine präzise Antwort auf die Frage zu den Metriken, Bewertungsdimensionen und Haupterkenntnissen der Web-basierten Nutzerstudie geben kann.","Die web-basierte Nutzerstudie mit 100 Teilnehmern verwendete sechs Bewertungsdimensionen auf einer Likert-Skala (1-5): Ease of Use, Relevance of Information, Transparency, System Responsiveness, Accuracy of Answers und Likelihood of Recommendation, ergänzt durch qualitative offene Feedback-Fragen. Die Haupterkenntnisse zeigten, dass Ease of Use und Accuracy of Answers konstant positive Bewertungen erhielten, während Transparency und Recommendation stärkere Variation zwischen den Systemen aufwiesen. Besonders bedeutsam war, dass 83% der Teilnehmer eine aufgabenabhängige Präferenz für KI-generierte Antworten zeigten, was darauf hinweist, dass Vertrauen in RAG-Systeme kontingent und nicht absolut ist, abhängig von Antwortrelevanz, Transparenz und Ausrichtung auf die Nutzerintention.",0.2,0.10638297872340426,0.13888888888888892,0.02040816326530612,0.010752688172043012,0.014084507042253521
P1_Q4,Warum wählten die Autoren Poro-34B für das AgriHubi-System und welche Vorteile bot dieses Modell gegenüber GPT-4o für finnischsprachige Inhalte?,"Um die Frage zu beantworten, warum die Autoren Poro-34B für das AgriHubi-System wählten und welche Vorteile dieses Modell gegenüber GPT-4o für finnischsprachige Inhalte bot, benötigen wir spezifische Informationen aus dem Kontext, der hier nicht bereitgestellt wurde. Allgemein könnte man jedoch spekulieren, dass Poro-34B möglicherweise aufgrund seiner besseren Anpassung an die finnische Sprache, seiner Effizienz oder seiner Fähigkeit, spezifische Anforderungen des AgriHubi-Systems zu erfüllen, gewählt wurde. Wenn Poro-34B speziell für finnischsprachige Inhalte optimiert wurde, könnte es eine bessere Genauigkeit und Relevanz in diesem Sprachbereich bieten als GPT-4o. Um eine präzise Antwort zu geben, wären jedoch genauere Details aus dem Kontext erforderlich.","Die Autoren wählten Poro-34B für das AgriHubi-System, weil allgemeine Modelle wie GPT-4o bei domänenspezifischen und finnischsprachigen Anfragen erhebliche Schwächen zeigten, während Poro-34B speziell für die finnische Sprache optimiert ist. Das finnisch-optimierte Modell lieferte kontextuell relevanteren Antworten für die Verarbeitung von 200+ finnischsprachigen landwirtschaftlichen PDFs und bot bessere Kompatibilität mit Embedding-Modellen wie text-embedding-ada-002. Diese Auswahl ermöglichte es, landwirtschaftliches Wissen durch eine Streamlit-Chat-Schnittstelle mit SQLite-Logging und Feedback-Mechanismus für kontinuierliche Verbesserung zugänglicher zu machen, was die Bedeutung domänenspezifischer Sprachmodelle für mehrsprachige RAG-Anwendungen unterstreicht.",0.21,0.2625,0.2333333333333333,0.050505050505050504,0.06329113924050633,0.056179775280898875
P1_Q5,"Welche zwölf Lessons Learned wurden dokumentiert und wie verteilen sich diese auf technische, operative und ethische Kategorien?","Um die Frage zu beantworten, benötige ich spezifische Informationen aus dem Kontext, der die ""Lessons Learned"" beschreibt. Da der Kontext nicht bereitgestellt wurde, kann ich keine detaillierten ""Lessons Learned"" oder deren Verteilung auf technische, operative und ethische Kategorien angeben. Wenn Sie den relevanten Text oder die Informationen bereitstellen, kann ich Ihnen dabei helfen, die Lessons Learned zu identifizieren und zu kategorisieren.","Die zwölf dokumentierten Lessons Learned verteilen sich auf drei Kategorien: Technical Development (5 Lessons) umfasst die Notwendigkeit domänenspezifischer Modelle, OCR-Fehlerauswirkungen auf Pipelines, Chunking-Balance zwischen Geschwindigkeit und Genauigkeit, FAISS-Skalierungsgrenzen und manuelles Environment-Management ohne Containerization. Operational Factors (5 Lessons) beinhalten SQLite für User-Interaction-Tracking, fragile Scraping-Pipelines, Self-Hosted-Setup für Geschwindigkeit und Compliance, saubere Daten für bessere Retrieval-Qualität und nutzerfeedback-gesteuerte Systemoptimierung. Ethical Considerations (2 Lessons) betreffen Quelldatei-Referenzen für Vertrauensaufbau und Dataset-Bias-Auswirkungen auf Retrieval-Balance, wobei die technischen Aspekte den größten Anteil ausmachen und die Komplexität der praktischen RAG-Implementierung in realen Anwendungen widerspiegeln.",0.16393442622950818,0.11627906976744186,0.13605442176870747,0.016666666666666666,0.011764705882352941,0.013793103448275862
P2_Q1,Wie ist ein Datenpunkt im MAGPIE-Benchmark formal definiert (als Tupel) und welche Rolle spielen die Penalties und Utilities im Kontext der Multi-Agenten-Interaktion?,"Im MAGPIE-Benchmark ist ein Datenpunkt formal als ein Tupel definiert, das die spezifischen Parameter und Ergebnisse einer Multi-Agenten-Interaktion beschreibt. Die genaue Struktur des Tupels kann je nach Implementierung variieren, umfasst aber typischerweise Elemente wie den Zustand der Umgebung, die Aktionen der Agenten, die resultierenden Belohnungen oder Strafen (Penalties), und die beobachteten Ergebnisse oder Nutzen (Utilities).

Die Penalties und Utilities spielen eine zentrale Rolle im Kontext der Multi-Agenten-Interaktion, da sie die Anreize und Konsequenzen für die Entscheidungen der Agenten darstellen. Penalties sind negative Rückmeldungen, die Agenten für unerwünschte oder ineffiziente Aktionen erhalten, während Utilities positive Rückmeldungen sind, die Agenten für erfolgreiche oder effiziente Aktionen erhalten. Diese Rückmeldungen beeinflussen das Lernen und die Entscheidungsfindung der Agenten, indem sie die Strategien und Verhaltensweisen anpassen, um bessere Ergebnisse in zukünftigen Interaktionen zu erzielen.","Ein Datenpunkt im MAGPIE-Benchmark ist formal als Tupel ⟨N, T, D, C, I, P, p, U⟩ definiert, wobei N eine endliche Menge von Agenten {a1, a2, ..., ak} darstellt, T eine offene Aufgabe wie Ressourcenzuteilung beschreibt, D ein Deliverable zur Aufgabenabschluss markiert, C Constraints aus öffentlichen und privaten Informationen ableitet, I öffentliche Informationen bezeichnet, P private/sensible Daten umfasst, p Penalties für Datenleckagen definiert und U Belohnungen für Teilaufgaben festlegt. Die Penalties und Utilities spielen eine zentrale Rolle in Multi-Agenten-Interaktionen, da sie realistische Trade-offs zwischen Aufgabenerfüllung und Datenschutz schaffen - Agenten müssen strategisch entscheiden, ob sie niedrig-penalisierte Informationen (pij = 1) teilen, um hoch-belohnte Ziele (uik = 5) zu erreichen, während sie sensible Daten (pil = 4) schützen.",0.26356589147286824,0.2905982905982906,0.2764227642276423,0.078125,0.08620689655172414,0.0819672131147541
P2_Q2,Welche spezifischen Leakage-Raten zeigten GPT-4o und Claude-3.7-Sonnet im Explicit Instruction Setting verglichen mit dem Implicit Instruction Setting?,"Um die spezifischen Leakage-Raten von GPT-4o und Claude-3.7-Sonnet im Explicit Instruction Setting im Vergleich zum Implicit Instruction Setting zu beantworten, benötige ich die entsprechenden Daten oder Ergebnisse aus der Studie oder dem Experiment, auf das sich die Frage bezieht. Da diese Informationen im bereitgestellten Kontext nicht enthalten sind, kann ich keine genaue Antwort geben. Bitte stellen Sie sicher, dass die relevanten Daten oder Ergebnisse im Kontext enthalten sind, damit ich Ihnen weiterhelfen kann.","Im Explicit Instruction Setting, wo Agenten explizit über Penalties informiert wurden (Leaking private information x incurs penalty y), zeigte GPT-4o eine deutlich niedrigere Leakage-Rate von 5.7%, während Claude-3.7-Sonnet mit 21.6% deutlich schlechter abschnitt. Im Implicit Instruction Setting, das realistischere Bedingungen mit generischen Warnungen simuliert (Some information is private; avoid sharing it), verschlechterten sich beide Modelle dramatisch: GPT-4o erreichte eine Leakage-Rate von 54.3% und Claude-3.7-Sonnet sogar 66.2%. Diese Ergebnisse demonstrieren, dass selbst state-of-the-art Modelle wie GPT-4o und Claude-3.7-Sonnet zwar gute Instruktionsbefolgung zeigen, aber ein mangelndes Verständnis für kontextuelle Privatsphäre aufweisen, wenn explizite Anweisungen fehlen.",0.1643835616438356,0.12903225806451613,0.14457831325301204,0.05555555555555555,0.043478260869565216,0.04878048780487805
P2_Q3,Wie wurde der Datengenerierungsprozess mittels LLM-Pipeline durchgeführt und welche Verifikationsschritte wurden implementiert?,"Um den Datengenerierungsprozess mittels einer LLM-Pipeline (Large Language Model) durchzuführen, wird typischerweise ein mehrstufiger Ansatz verwendet. Zunächst wird das Modell mit einer großen Menge an Textdaten trainiert, um ein breites Verständnis der Sprache zu entwickeln. Anschließend kann das Modell genutzt werden, um neue Daten zu generieren, indem es auf spezifische Eingaben reagiert und darauf basierend Texte erstellt.

Die Verifikationsschritte in einem solchen Prozess sind entscheidend, um die Qualität und Zuverlässigkeit der generierten Daten sicherzustellen. Diese Schritte können Folgendes umfassen:

1. **Qualitätskontrolle durch menschliche Überprüfung**: Experten überprüfen stichprobenartig die generierten Daten, um sicherzustellen, dass sie sinnvoll und korrekt sind.

2. **Automatisierte Tests**: Implementierung von Algorithmen, die die generierten Daten auf Konsistenz, Grammatik und Relevanz prüfen.

3. **Feedback-Schleifen**: Nutzung von Benutzerfeedback, um das Modell kontinuierlich zu verbessern und Anpassungen vorzunehmen.

4. **Vergleich mit bestehenden Daten**: Die generierten Daten werden mit bereits vorhandenen, verifizierten Daten verglichen, um Abweichungen oder Fehler zu identifizieren.

Durch diese Verifikationsschritte wird sichergestellt, dass die Daten, die durch die LLM-Pipeline generiert werden, von hoher Qualität sind und den Anforderungen der jeweiligen Anwendung entsprechen.","Der Datengenerierungsprozess wurde durch eine mehrstufige LLM-Pipeline durchgeführt, die Claude-3.7-Sonnet sowohl als Generator als auch als Verifizierer nutzte. Der Prozess begann mit manuell kuratierten Seeds für verschiedene Domänen, gefolgt von automatischer Szenario-Generierung durch das LLM, das realistische High-Stakes-Szenarien vorschlug. Jede Stufe beinhaltete strenge Verifikationsschritte: Ein Verifizierer-LLM bewertete die Realitätsnähe und den Einsatz der Szenarien, überprüfte die Aufgaben-Agent-Ausrichtung, validierte die Kohärenz von Agentenprofilen und stellte sicher, dass private Informationen natürlich motiviert waren. Zusätzlich wurden durch einen finalen Verifikationsschritt Deliverables und Constraints gegen die Aufgabenziele geprüft, um konfliktfreie und lösbare Aufgaben zu gewährleisten.",0.13793103448275862,0.26373626373626374,0.18113207547169813,0.005780346820809248,0.011111111111111112,0.007604562737642586
P2_Q4,"Was ist der Zusammenhang zwischen der Leakage-Rate und der Task-Success-Rate, wie in Abbildung 7 dargestellt?","Um die Beziehung zwischen der Leakage-Rate und der Task-Success-Rate zu verstehen, wie sie in Abbildung 7 dargestellt ist, müssten wir die spezifischen Details und Daten aus dieser Abbildung betrachten. Allgemein gesprochen, beschreibt die Leakage-Rate oft den Anteil der Informationen, die ungewollt aus einem System entweichen, während die Task-Success-Rate den Anteil der erfolgreich abgeschlossenen Aufgaben angibt.

In vielen Kontexten könnte eine höhere Leakage-Rate zu einer niedrigeren Task-Success-Rate führen, da ungewollte Informationsverluste die Effektivität und Effizienz eines Systems beeinträchtigen können. Umgekehrt könnte eine niedrige Leakage-Rate mit einer höheren Task-Success-Rate korrelieren, da das System stabiler und zuverlässiger arbeitet.

Ohne die spezifischen Daten aus Abbildung 7 ist es jedoch schwierig, eine genaue Aussage über den Zusammenhang zu treffen. Es wäre hilfreich, die Abbildung direkt zu analysieren, um die dargestellten Trends und Korrelationen zu verstehen.","Abbildung 7 zeigt eine starke negative Korrelation zwischen der Leakage-Rate und sowohl der Konsens- als auch der Erfolgswahrscheinlichkeit. Aufgaben mit ≤10% Leakage erreichten nur 10.8% Konsens und 6.3% Erfolg, während die Raten bei etwa 67% Leakage plateauieren. Diese Beziehung verdeutlicht ein fundamentales Dilemma in Multi-Agenten-Systemen: Während strikte Datenschutzwahrung die Aufgabenerfüllung behindert, führt uneingeschränktes Informationsteilen zu höheren Erfolgsraten, aber auch zu Datenschutzverletzungen. Die Gesamtkonsens- und Erfolgsrate über alle Modelle betrug nur 51% bzw. 29.7%, was zeigt, dass aktuelle Modelle weder auf kontextuelle Datenschutzwahrung noch auf effektive Multi-Agenten-Kollaboration ausgerichtet sind.",0.16923076923076924,0.25,0.2018348623853211,0.03875968992248062,0.05747126436781609,0.046296296296296294
P2_Q5,Welche fünf Hauptdomänen deckt der MAGPIE-Datensatz ab und welche Art von High-Stakes-Szenarien wurden für jede Domäne entwickelt?,"Der MAGPIE-Datensatz deckt fünf Hauptdomänen ab: Recht, Medizin, Finanzen, Bildung und Technik. Für jede dieser Domänen wurden spezifische High-Stakes-Szenarien entwickelt, um die Herausforderungen und Risiken in diesen Bereichen zu simulieren und zu analysieren. Leider sind die genauen Details der High-Stakes-Szenarien für jede Domäne im gegebenen Kontext nicht spezifiziert.","Der MAGPIE-Datensatz umfasst 158 Aufgaben über 16 verschiedene High-Impact-Domänen, wobei die Hauptkategorien Legal, Scheduling, Healthcare, Tech & Infrastructure und Research umfassen. Spezifische High-Stakes-Szenarien beinhalten strategische GPU-Ressourcenzuteilung zwischen Forschungsteams mit privaten Projektdetails und Latenzanforderungen, Universitätszulassungen mit vertraulichen Budgetbeschränkungen und Bewerberdaten, Gehaltsverhandlungen mit sensiblen Informationen über andere Mitarbeitergehälter, Büro-Miteigentümerschaftsvereinbarungen mit privaten finanziellen Präferenzen und Crowdsourced Innovation in der Pharmaentwicklung mit teilweise geheimen Forschungsdurchbrüchen. Diese Szenarien wurden bewusst so gestaltet, dass vollständiger Ausschluss privater Daten die Aufgabenerfüllung behindert, während uneingeschränktes Teilen zu erheblichen realen Verlusten führen könnte.",0.25,0.14285714285714285,0.18181818181818182,0.02127659574468085,0.012048192771084338,0.015384615384615384
P3_Q1,Welche drei Hauptparameter (state vector v) verwendet das AHS-System zur Entscheidungsfindung und welche konkreten Schwellenwerte wurden durch Bayesian Optimization ermittelt?,"Um die Frage zu beantworten, benötige ich spezifische Informationen aus dem Kontext, der die drei Hauptparameter des AHS-Systems und die durch Bayesian Optimization ermittelten Schwellenwerte beschreibt. Da der Kontext nicht bereitgestellt wurde, kann ich keine genaue Antwort geben. Bitte stellen Sie sicher, dass der relevante Kontext zur Verfügung steht, damit ich Ihnen weiterhelfen kann.","Das AHS-System verwendet einen dreidimensionalen Zustandsvektor v = (n, k, H) zur dynamischen Entscheidungsfindung. Dabei repräsentiert n die Eingabegröße (Kardinalität des Arrays), k den Wertebereich (max(arr) - min(arr) + 1), und H die Informationsentropie (−∑ᵢ₌₁ᵏ pᵢ log₂ pᵢ). Durch multi-objektive Bayesian Optimization wurden die optimalen Schwellenwerte ermittelt: nthreshold = 20 (gegenüber theoretischen 16), kthreshold = 1.024 (gegenüber theoretischen 1.000), und kmax = 10⁶ (gegenüber theoretischen 2²⁰). Die Kalibrierung erfolgte durch Minimierung einer gewichteten Summe aus normalisierter Ausführungszeit und Speicherverbrauch mit α = 0.7 als Zeit-Speicher-Tradeoff-Parameter.",0.2037037037037037,0.12941176470588237,0.15827338129496404,0.018867924528301886,0.011904761904761904,0.014598540145985401
P3_Q2,Wie wurde der XGBoost-Klassifikator trainiert und welche Accuracy erreichte er bei der Vorhersage der optimalen Sortierstrategie?,"Um die Frage zu beantworten, wie der XGBoost-Klassifikator trainiert wurde und welche Genauigkeit (Accuracy) er bei der Vorhersage der optimalen Sortierstrategie erreichte, benötige ich spezifische Informationen aus dem Kontext, den Sie bereitstellen sollten. Der Kontext sollte Details über den Trainingsprozess, die verwendeten Daten, die Hyperparameter und die Ergebnisse des Modells enthalten. Bitte fügen Sie diese Informationen hinzu, damit ich Ihnen eine präzise Antwort geben kann.","Der XGBoost-Klassifikator wurde auf 10.000 synthetischen Datensätzen trainiert, die verschiedene Kombinationen von Eingabeparametern abdeckten: n ∈ [10³, 10⁹], k ∈ [10, 10⁶], und H ∈ [0, log₂ k]. Das Modell erreichte eine Vorhersagegenauigkeit von 92.4% bei der Auswahl der optimalen Sortierstrategie, ergänzt durch einen F1-Score von 0.89, was robuste Performance auch bei unausgewogenen Strategieverteilungen demonstriert. Die Entscheidungslatenz beträgt nur 0.2ms pro Entscheidung, während das durch 8-Bit-Quantisierung optimierte Modell lediglich 1MB Speicher benötigt, was es für ressourcenbeschränkte Edge-Computing-Umgebungen geeignet macht.",0.15384615384615385,0.12658227848101267,0.1388888888888889,0.03125,0.02564102564102564,0.028169014084507043
