question_id,question_string,answer_llm,answer_gold
P1_Q1,"Welche spezifischen Herausforderungen identifizierten die Autoren beim Einsatz von OCR in den Agriculture- und Healthcare-PDFs, und welche Lösungsansätze wurden implementiert?","Um die spezifischen Herausforderungen beim Einsatz von OCR (Optical Character Recognition) in den Bereichen Landwirtschaft und Gesundheitswesen zu identifizieren, müsste man den genauen Inhalt der Studie oder des Artikels kennen, auf den sich die Frage bezieht. Allgemein lassen sich jedoch einige typische Herausforderungen und Lösungsansätze für OCR in diesen Bereichen beschreiben:

1. **Herausforderungen:**
   - **Vielzahl von Dokumentenformaten:** In beiden Bereichen gibt es eine Vielzahl von Dokumentenformaten und -strukturen, die OCR erschweren können.
   - **Qualität der Scans:** Oftmals sind die gescannten Dokumente von schlechter Qualität, was die Erkennungsrate von OCR-Software beeinträchtigen kann.
   - **Fachspezifische Terminologie:** Die Verwendung von fachspezifischen Begriffen und Symbolen, die nicht immer von Standard-OCR-Software erkannt werden.
   - **Handschriftliche Notizen:** Besonders im Gesundheitswesen sind handschriftliche Notizen häufig, die für OCR eine besondere Herausforderung darstellen.

2. **Lösungsansätze:**
   - **Anpassung und Training von OCR-Modellen:** Durch das Training von OCR-Modellen auf spezifische Datensätze aus der Landwirtschaft und dem Gesundheitswesen kann die Erkennungsgenauigkeit verbessert werden.
   - **Vorverarbeitung der Dokumente:** Techniken zur Verbesserung der Bildqualität, wie Rauschunterdrückung und Kontrastanpassung, können die OCR-Leistung verbessern.
   - **Integration von Fachwörterbüchern:** Die Verwendung von spezialisierten Wörterbüchern und Glossaren kann helfen, fachspezifische Begriffe korrekt zu erkennen.
   - **Hybridansätze:** Kombination von OCR mit anderen Technologien wie Natural Language Processing (NLP) zur besseren Interpretation und Strukturierung der erkannten Texte.

Für eine detaillierte Antwort wäre es notwendig, den spezifischen Artikel oder die Studie zu konsultieren, auf die sich die Frage bezieht.","Die Autoren identifizierten noisy OCR-Output als Hauptherausforderung, der die FAISS-Qualität in Agriculture- und Healthcare-PDFs erheblich degradierte und die Retrieval-Genauigkeit limitierte. Als Lösungsansätze implementierten sie eine Kombination aus TesseractOCR und easyOCR als alternative OCR-Engines, ergänzt durch regex-basierte Cleanup-Verfahren zur systematischen Nachbearbeitung des extrahierten Texts. Zusätzlich integrierten sie PyMuPDF für die Extraktion sowohl text-basierter als auch bild-basierter Inhalte und führten systematische Datenbereinigungsverfahren ein, die die Entfernung von OCR-Rauschen und Duplikaten zur Verbesserung der Retrieval-Qualität ohne Modifikation der Modelle ermöglichten."
P1_Q2,"Wie unterscheidet sich die Systemarchitektur zwischen dem Disarm RAG und den anderen vier implementierten Systemen, insbesondere hinsichtlich der Datenschutzanforderungen?","Um die Unterschiede in der Systemarchitektur zwischen dem Disarm RAG und den anderen vier implementierten Systemen zu verstehen, insbesondere in Bezug auf die Datenschutzanforderungen, müsste man spezifische Details über die Architektur jedes Systems kennen. Allgemein lässt sich jedoch sagen, dass Systeme, die unterschiedliche Datenschutzanforderungen haben, oft in ihrer Datenverarbeitung, Speicherung und Zugriffskontrolle variieren.

Disarm RAG könnte sich von den anderen Systemen unterscheiden, indem es beispielsweise:

1. **Datenanonymisierung**: Stärkere Mechanismen zur Anonymisierung von Daten implementiert, um die Privatsphäre der Nutzer zu schützen.

2. **Zugriffskontrollen**: Strengere Zugriffskontrollen und Authentifizierungsmechanismen verwendet, um sicherzustellen, dass nur autorisierte Personen auf sensible Daten zugreifen können.

3. **Datenverschlüsselung**: Umfassendere Verschlüsselungstechniken einsetzt, sowohl für Daten im Ruhezustand als auch für Daten während der Übertragung.

4. **Datenminimierung**: Prinzipien der Datenminimierung anwendet, um nur die notwendigsten Daten zu sammeln und zu verarbeiten.

5. **Transparenz und Einwilligung**: Verbesserte Mechanismen zur Einholung der Einwilligung der Nutzer und zur Bereitstellung von Transparenz über die Datennutzung implementiert.

Ohne spezifische Informationen über die Architektur der Systeme ist dies jedoch eine allgemeine Annahme. Für eine genaue Analyse wäre es notwendig, die technischen Dokumentationen oder Architekturdiagramme der jeweiligen Systeme zu prüfen.","Das Disarm RAG-System unterscheidet sich fundamental von den anderen vier Systemen durch seine sicherheitsorientierte Architektur und Datenschutzanforderungen. Es wird auf einem sicheren Server bei CSC (Finnish IT Center for Science) gehostet, um vollständige Datenprivatsphäre zu gewährleisten, und verwendet LLaMA 2-uncensored via Ollama für offenen Zugang zu Cybersecurity-Wissen. Der entscheidende Unterschied liegt darin, dass Disarm RAG bewusst auf Quellzitationen verzichtet, während alle anderen Systeme Quellenreferenzen zur Transparenz anzeigen - diese Ausnahme erfolgt aufgrund der Sensitivität von Cybersecurity-Inhalten, um sensitive Materialien zu schützen und gleichzeitig GDPR-Risiken zu reduzieren."
P1_Q3,"Welche konkreten Metriken und Bewertungsdimensionen wurden in der Web-basierten Nutzerstudie mit 100 Teilnehmern verwendet, und was waren die Haupterkenntnisse?","Um die Frage zu beantworten, benötige ich spezifische Informationen aus der genannten Web-basierten Nutzerstudie. Da der Kontext nicht bereitgestellt wurde, kann ich keine konkreten Metriken und Bewertungsdimensionen nennen, die in der Studie verwendet wurden, noch die Haupterkenntnisse daraus. Wenn Sie weitere Details oder den vollständigen Kontext bereitstellen können, helfe ich Ihnen gerne weiter.","Die web-basierte Nutzerstudie mit 100 Teilnehmern verwendete sechs Bewertungsdimensionen auf einer Likert-Skala (1-5): Ease of Use, Relevance of Information, Transparency, System Responsiveness, Accuracy of Answers und Likelihood of Recommendation, ergänzt durch qualitative offene Feedback-Fragen. Die Haupterkenntnisse zeigten, dass Ease of Use und Accuracy of Answers konstant positive Bewertungen erhielten, während Transparency und Recommendation stärkere Variation zwischen den Systemen aufwiesen. Besonders bedeutsam war, dass 83% der Teilnehmer eine aufgabenabhängige Präferenz für KI-generierte Antworten zeigten, was darauf hinweist, dass Vertrauen in RAG-Systeme kontingent und nicht absolut ist, abhängig von Antwortrelevanz, Transparenz und Ausrichtung auf die Nutzerintention."
P1_Q4,Warum wählten die Autoren Poro-34B für das AgriHubi-System und welche Vorteile bot dieses Modell gegenüber GPT-4o für finnischsprachige Inhalte?,"Basierend auf dem gegebenen Kontext kann ich keine spezifischen Informationen darüber bereitstellen, warum die Autoren Poro-34B für das AgriHubi-System gewählt haben oder welche Vorteile dieses Modell gegenüber GPT-4o für finnischsprachige Inhalte bietet. Um diese Frage zu beantworten, wäre es notwendig, mehr Details über die Eigenschaften und Vorteile von Poro-34B im Vergleich zu GPT-4o zu kennen, insbesondere in Bezug auf die Verarbeitung finnischsprachiger Inhalte.","Die Autoren wählten Poro-34B für das AgriHubi-System, weil allgemeine Modelle wie GPT-4o bei domänenspezifischen und finnischsprachigen Anfragen erhebliche Schwächen zeigten, während Poro-34B speziell für die finnische Sprache optimiert ist. Das finnisch-optimierte Modell lieferte kontextuell relevanteren Antworten für die Verarbeitung von 200+ finnischsprachigen landwirtschaftlichen PDFs und bot bessere Kompatibilität mit Embedding-Modellen wie text-embedding-ada-002. Diese Auswahl ermöglichte es, landwirtschaftliches Wissen durch eine Streamlit-Chat-Schnittstelle mit SQLite-Logging und Feedback-Mechanismus für kontinuierliche Verbesserung zugänglicher zu machen, was die Bedeutung domänenspezifischer Sprachmodelle für mehrsprachige RAG-Anwendungen unterstreicht."
P1_Q5,"Welche zwölf Lessons Learned wurden dokumentiert und wie verteilen sich diese auf technische, operative und ethische Kategorien?","Um die Frage zu beantworten, benötige ich spezifische Informationen aus dem Kontext, der die ""Lessons Learned"" beschreibt. Da der Kontext nicht bereitgestellt wurde, kann ich die zwölf Lessons Learned und deren Verteilung auf technische, operative und ethische Kategorien nicht direkt angeben. Bitte geben Sie den relevanten Kontext oder die Details an, damit ich Ihnen weiterhelfen kann.","Die zwölf dokumentierten Lessons Learned verteilen sich auf drei Kategorien: Technical Development (5 Lessons) umfasst die Notwendigkeit domänenspezifischer Modelle, OCR-Fehlerauswirkungen auf Pipelines, Chunking-Balance zwischen Geschwindigkeit und Genauigkeit, FAISS-Skalierungsgrenzen und manuelles Environment-Management ohne Containerization. Operational Factors (5 Lessons) beinhalten SQLite für User-Interaction-Tracking, fragile Scraping-Pipelines, Self-Hosted-Setup für Geschwindigkeit und Compliance, saubere Daten für bessere Retrieval-Qualität und nutzerfeedback-gesteuerte Systemoptimierung. Ethical Considerations (2 Lessons) betreffen Quelldatei-Referenzen für Vertrauensaufbau und Dataset-Bias-Auswirkungen auf Retrieval-Balance, wobei die technischen Aspekte den größten Anteil ausmachen und die Komplexität der praktischen RAG-Implementierung in realen Anwendungen widerspiegeln."
P2_Q1,Wie ist ein Datenpunkt im MAGPIE-Benchmark formal definiert (als Tupel) und welche Rolle spielen die Penalties und Utilities im Kontext der Multi-Agenten-Interaktion?,"Im MAGPIE-Benchmark ist ein Datenpunkt formal als Tupel definiert, das typischerweise die Form \((s, a, r, s')\) hat, wobei \(s\) der aktuelle Zustand, \(a\) die Aktion, \(r\) die Belohnung (reward) und \(s'\) der nächste Zustand ist. In diesem Kontext spielen Penalties und Utilities eine wichtige Rolle bei der Bewertung der Aktionen von Agenten innerhalb der Multi-Agenten-Interaktion. Penalties sind negative Belohnungen, die Agenten für unerwünschte Aktionen oder Zustände erhalten, während Utilities positive Belohnungen sind, die Agenten für erwünschte Aktionen oder Zustände erhalten. Diese Konzepte helfen dabei, das Verhalten der Agenten zu steuern und zu optimieren, indem sie Anreize für bestimmte Handlungen schaffen und andere entmutigen.","Ein Datenpunkt im MAGPIE-Benchmark ist formal als Tupel ⟨N, T, D, C, I, P, p, U⟩ definiert, wobei N eine endliche Menge von Agenten {a1, a2, ..., ak} darstellt, T eine offene Aufgabe wie Ressourcenzuteilung beschreibt, D ein Deliverable zur Aufgabenabschluss markiert, C Constraints aus öffentlichen und privaten Informationen ableitet, I öffentliche Informationen bezeichnet, P private/sensible Daten umfasst, p Penalties für Datenleckagen definiert und U Belohnungen für Teilaufgaben festlegt. Die Penalties und Utilities spielen eine zentrale Rolle in Multi-Agenten-Interaktionen, da sie realistische Trade-offs zwischen Aufgabenerfüllung und Datenschutz schaffen - Agenten müssen strategisch entscheiden, ob sie niedrig-penalisierte Informationen (pij = 1) teilen, um hoch-belohnte Ziele (uik = 5) zu erreichen, während sie sensible Daten (pil = 4) schützen."
P2_Q2,Welche spezifischen Leakage-Raten zeigten GPT-4o und Claude-3.7-Sonnet im Explicit Instruction Setting verglichen mit dem Implicit Instruction Setting?,"Um die spezifischen Leakage-Raten von GPT-4o und Claude-3.7-Sonnet im Explicit Instruction Setting im Vergleich zum Implicit Instruction Setting zu beantworten, benötige ich die entsprechenden Daten oder Ergebnisse aus der Studie oder dem Experiment, auf das sich die Frage bezieht. Da diese Informationen im bereitgestellten Kontext nicht enthalten sind, kann ich keine genaue Antwort geben. Wenn Sie die spezifischen Ergebnisse oder Daten haben, teilen Sie diese bitte mit, damit ich Ihnen weiterhelfen kann.","Im Explicit Instruction Setting, wo Agenten explizit über Penalties informiert wurden (Leaking private information x incurs penalty y), zeigte GPT-4o eine deutlich niedrigere Leakage-Rate von 5.7%, während Claude-3.7-Sonnet mit 21.6% deutlich schlechter abschnitt. Im Implicit Instruction Setting, das realistischere Bedingungen mit generischen Warnungen simuliert (Some information is private; avoid sharing it), verschlechterten sich beide Modelle dramatisch: GPT-4o erreichte eine Leakage-Rate von 54.3% und Claude-3.7-Sonnet sogar 66.2%. Diese Ergebnisse demonstrieren, dass selbst state-of-the-art Modelle wie GPT-4o und Claude-3.7-Sonnet zwar gute Instruktionsbefolgung zeigen, aber ein mangelndes Verständnis für kontextuelle Privatsphäre aufweisen, wenn explizite Anweisungen fehlen."
P2_Q3,Wie wurde der Datengenerierungsprozess mittels LLM-Pipeline durchgeführt und welche Verifikationsschritte wurden implementiert?,"Um den Datengenerierungsprozess mittels einer LLM-Pipeline (Large Language Model) durchzuführen, wird in der Regel ein mehrstufiger Ansatz verfolgt. Zunächst wird das Modell mit einer großen Menge an Textdaten trainiert, um ein breites Verständnis für Sprache und Kontext zu entwickeln. Anschließend wird das Modell genutzt, um neue Daten zu generieren, indem es auf spezifische Eingaben reagiert oder bestimmte Aufgaben erfüllt.

Die Verifikationsschritte in diesem Prozess sind entscheidend, um die Qualität und Zuverlässigkeit der generierten Daten sicherzustellen. Typische Verifikationsschritte könnten Folgendes umfassen:

1. **Qualitätskontrolle:** Überprüfung der generierten Daten durch menschliche Experten, um sicherzustellen, dass sie den gewünschten Standards entsprechen.
2. **Automatisierte Tests:** Einsatz von Algorithmen, um die Konsistenz und Korrektheit der Daten zu überprüfen.
3. **Feedback-Schleifen:** Implementierung von Mechanismen, die es ermöglichen, Feedback von Nutzern oder Testern zu sammeln und das Modell entsprechend anzupassen.
4. **Bias-Analyse:** Untersuchung der Daten auf mögliche Verzerrungen oder Voreingenommenheiten, um sicherzustellen, dass die Ergebnisse fair und ausgewogen sind.

Diese Schritte helfen dabei, die Integrität des Datengenerierungsprozesses zu wahren und die Verlässlichkeit der Ergebnisse zu gewährleisten.","Der Datengenerierungsprozess wurde durch eine mehrstufige LLM-Pipeline durchgeführt, die Claude-3.7-Sonnet sowohl als Generator als auch als Verifizierer nutzte. Der Prozess begann mit manuell kuratierten Seeds für verschiedene Domänen, gefolgt von automatischer Szenario-Generierung durch das LLM, das realistische High-Stakes-Szenarien vorschlug. Jede Stufe beinhaltete strenge Verifikationsschritte: Ein Verifizierer-LLM bewertete die Realitätsnähe und den Einsatz der Szenarien, überprüfte die Aufgaben-Agent-Ausrichtung, validierte die Kohärenz von Agentenprofilen und stellte sicher, dass private Informationen natürlich motiviert waren. Zusätzlich wurden durch einen finalen Verifikationsschritt Deliverables und Constraints gegen die Aufgabenziele geprüft, um konfliktfreie und lösbare Aufgaben zu gewährleisten."
P2_Q4,"Was ist der Zusammenhang zwischen der Leakage-Rate und der Task-Success-Rate, wie in Abbildung 7 dargestellt?","Um die Beziehung zwischen der Leakage-Rate und der Task-Success-Rate zu verstehen, wie sie in Abbildung 7 dargestellt ist, müssen wir die spezifischen Details der Abbildung betrachten. Da ich die Abbildung nicht direkt sehen kann, kann ich nur allgemeine Informationen geben.

In einem typischen Szenario könnte die Leakage-Rate die Rate sein, mit der Informationen ungewollt preisgegeben werden, während die Task-Success-Rate die Rate ist, mit der eine bestimmte Aufgabe erfolgreich abgeschlossen wird. Ein möglicher Zusammenhang könnte sein, dass eine höhere Leakage-Rate zu einer niedrigeren Task-Success-Rate führt, da das ungewollte Preisgeben von Informationen die Effektivität oder Sicherheit der Aufgabe beeinträchtigen könnte. Alternativ könnte eine hohe Task-Success-Rate auch mit einer niedrigen Leakage-Rate korrelieren, wenn die Aufgabe darin besteht, Informationen sicher zu verarbeiten.

Um den genauen Zusammenhang zu verstehen, wäre es wichtig, die spezifischen Daten und die Darstellung in Abbildung 7 zu analysieren.","Abbildung 7 zeigt eine starke negative Korrelation zwischen der Leakage-Rate und sowohl der Konsens- als auch der Erfolgswahrscheinlichkeit. Aufgaben mit ≤10% Leakage erreichten nur 10.8% Konsens und 6.3% Erfolg, während die Raten bei etwa 67% Leakage plateauieren. Diese Beziehung verdeutlicht ein fundamentales Dilemma in Multi-Agenten-Systemen: Während strikte Datenschutzwahrung die Aufgabenerfüllung behindert, führt uneingeschränktes Informationsteilen zu höheren Erfolgsraten, aber auch zu Datenschutzverletzungen. Die Gesamtkonsens- und Erfolgsrate über alle Modelle betrug nur 51% bzw. 29.7%, was zeigt, dass aktuelle Modelle weder auf kontextuelle Datenschutzwahrung noch auf effektive Multi-Agenten-Kollaboration ausgerichtet sind."
P2_Q5,Welche fünf Hauptdomänen deckt der MAGPIE-Datensatz ab und welche Art von High-Stakes-Szenarien wurden für jede Domäne entwickelt?,"Der MAGPIE-Datensatz deckt fünf Hauptdomänen ab: Bildung, Finanzen, Recht, Medizin und Psychologie. Für jede dieser Domänen wurden spezifische High-Stakes-Szenarien entwickelt, die komplexe und kritische Entscheidungssituationen in diesen Bereichen simulieren. Diese Szenarien sind darauf ausgelegt, die Herausforderungen und Risiken zu reflektieren, die in realen Situationen innerhalb jeder Domäne auftreten können.","Der MAGPIE-Datensatz umfasst 158 Aufgaben über 16 verschiedene High-Impact-Domänen, wobei die Hauptkategorien Legal, Scheduling, Healthcare, Tech & Infrastructure und Research umfassen. Spezifische High-Stakes-Szenarien beinhalten strategische GPU-Ressourcenzuteilung zwischen Forschungsteams mit privaten Projektdetails und Latenzanforderungen, Universitätszulassungen mit vertraulichen Budgetbeschränkungen und Bewerberdaten, Gehaltsverhandlungen mit sensiblen Informationen über andere Mitarbeitergehälter, Büro-Miteigentümerschaftsvereinbarungen mit privaten finanziellen Präferenzen und Crowdsourced Innovation in der Pharmaentwicklung mit teilweise geheimen Forschungsdurchbrüchen. Diese Szenarien wurden bewusst so gestaltet, dass vollständiger Ausschluss privater Daten die Aufgabenerfüllung behindert, während uneingeschränktes Teilen zu erheblichen realen Verlusten führen könnte."
P3_Q1,Welche drei Hauptparameter (state vector v) verwendet das AHS-System zur Entscheidungsfindung und welche konkreten Schwellenwerte wurden durch Bayesian Optimization ermittelt?,"Um die Frage zu beantworten, welche drei Hauptparameter (state vector v) das AHS-System zur Entscheidungsfindung verwendet und welche konkreten Schwellenwerte durch Bayesian Optimization ermittelt wurden, benötige ich spezifische Informationen aus dem Kontext, der hier nicht bereitgestellt wurde. 

Falls der Kontext Informationen über das AHS-System (Advanced Driver Assistance Systems oder ein ähnliches System) und die durch Bayesian Optimization ermittelten Schwellenwerte enthält, müssten diese Details direkt aus dem Kontext entnommen werden. 

Bitte stellen Sie den relevanten Kontext bereit, damit ich die Frage präzise beantworten kann.","Das AHS-System verwendet einen dreidimensionalen Zustandsvektor v = (n, k, H) zur dynamischen Entscheidungsfindung. Dabei repräsentiert n die Eingabegröße (Kardinalität des Arrays), k den Wertebereich (max(arr) - min(arr) + 1), und H die Informationsentropie (−∑ᵢ₌₁ᵏ pᵢ log₂ pᵢ). Durch multi-objektive Bayesian Optimization wurden die optimalen Schwellenwerte ermittelt: nthreshold = 20 (gegenüber theoretischen 16), kthreshold = 1.024 (gegenüber theoretischen 1.000), und kmax = 10⁶ (gegenüber theoretischen 2²⁰). Die Kalibrierung erfolgte durch Minimierung einer gewichteten Summe aus normalisierter Ausführungszeit und Speicherverbrauch mit α = 0.7 als Zeit-Speicher-Tradeoff-Parameter."
P3_Q2,Wie wurde der XGBoost-Klassifikator trainiert und welche Accuracy erreichte er bei der Vorhersage der optimalen Sortierstrategie?,"Um die Frage zu beantworten, wie der XGBoost-Klassifikator trainiert wurde und welche Genauigkeit (Accuracy) er bei der Vorhersage der optimalen Sortierstrategie erreichte, benötige ich spezifische Informationen aus dem Kontext, den Sie bereitstellen sollten. Der Kontext sollte Details über den Trainingsprozess, die verwendeten Daten und die erzielten Ergebnisse enthalten. Bitte stellen Sie diese Informationen bereit, damit ich Ihnen eine präzise Antwort geben kann.","Der XGBoost-Klassifikator wurde auf 10.000 synthetischen Datensätzen trainiert, die verschiedene Kombinationen von Eingabeparametern abdeckten: n ∈ [10³, 10⁹], k ∈ [10, 10⁶], und H ∈ [0, log₂ k]. Das Modell erreichte eine Vorhersagegenauigkeit von 92.4% bei der Auswahl der optimalen Sortierstrategie, ergänzt durch einen F1-Score von 0.89, was robuste Performance auch bei unausgewogenen Strategieverteilungen demonstriert. Die Entscheidungslatenz beträgt nur 0.2ms pro Entscheidung, während das durch 8-Bit-Quantisierung optimierte Modell lediglich 1MB Speicher benötigt, was es für ressourcenbeschränkte Edge-Computing-Umgebungen geeignet macht."
P3_Q3,"Unter welchen spezifischen Bedingungen wählt das System Counting Sort, Radix Sort oder QuickSort, basierend auf den Werten von k und H?","Um die Wahl zwischen Counting Sort, Radix Sort und QuickSort zu treffen, basierend auf den Werten von \( k \) (der Bereich der möglichen Schlüsselwerte) und \( H \) (die Anzahl der zu sortierenden Elemente), können folgende Überlegungen angestellt werden:

1. **Counting Sort**: Dieses Sortierverfahren ist besonders effizient, wenn der Bereich der Schlüsselwerte \( k \) relativ klein ist im Vergleich zur Anzahl der Elemente \( H \). Die Zeitkomplexität von Counting Sort ist \( O(k + H) \), was bedeutet, dass es dann vorteilhaft ist, wenn \( k \) nicht wesentlich größer als \( H \) ist.

2. **Radix Sort**: Radix Sort ist geeignet, wenn die Schlüsselwerte in einer Weise dargestellt werden können, die eine stabile Sortierung in mehreren Durchgängen ermöglicht (z.B. Ziffern in einer Zahl). Es ist besonders effizient, wenn die Anzahl der Stellen oder Ziffern, die sortiert werden müssen, klein ist. Radix Sort kann in Verbindung mit Counting Sort verwendet werden, um jede Stelle zu sortieren, und hat eine Zeitkomplexität von \( O(d \cdot (k + H)) \), wobei \( d \) die Anzahl der Stellen ist.

3. **QuickSort**: QuickSort ist ein allgemeines Sortierverfahren, das gut funktioniert, wenn keine spezifischen Bedingungen für \( k \) und \( H \) vorliegen. Es hat eine durchschnittliche Zeitkomplexität von \( O(H \log H) \) und ist oft die bevorzugte Wahl, wenn \( k \) sehr groß ist oder wenn die Daten nicht gleichmäßig verteilt sind.

Zusammengefasst:
- Wähle **Counting Sort**, wenn \( k \) klein ist im Vergleich zu \( H \).
- Wähle **Radix Sort**, wenn die Daten in einer Weise dargestellt werden können, die eine mehrfache stabile Sortierung ermöglicht und \( k \) nicht zu groß ist.
- Wähle **QuickSort**, wenn \( k \) groß ist oder wenn keine spezifischen Vorteile der anderen Algorithmen genutzt werden können.","Das System implementiert eine hierarchische Entscheidungslogik basierend auf den Werten von k und H: Counting Sort wird gewählt, wenn k ≤ 1000 (kleine Schlüsselbereiche) für optimale lineare Zeitkomplexität; Radix Sort kommt zum Einsatz, wenn k > 10⁶ UND H < 0.7·log₂(k) (große Bereiche mit strukturierten, niedrig-entropischen Daten) für überlegene Speichercharakteristika; QuickSort dient als Fallback-Strategie für alle anderen allgemeinen Fälle und gewährleistet robuste O(n log n) Performance. Zusätzlich wird Insertion Sort automatisch für sehr kleine Datensätze (n ≤ 20) ausgewählt, um dessen exceptional Cache-Effizienz in diesem Bereich zu nutzen."
P3_Q4,Welche Performance-Verbesserungen (in Prozent) wurden im Vergleich zu statischen Sortieralgorithmen auf verschiedenen Datensätzen erzielt?,"Um die Frage zu beantworten, benötige ich spezifische Informationen aus dem Kontext, der die Performance-Verbesserungen beschreibt. Da der Kontext nicht bereitgestellt wurde, kann ich keine genauen Prozentzahlen nennen. Wenn Sie die relevanten Informationen oder Daten zur Verfügung stellen, kann ich Ihnen helfen, die Performance-Verbesserungen zu analysieren.","Die experimentellen Ergebnisse zeigen signifikante Performance-Steigerungen: AHS erreichte 30-40% Reduktion der Ausführungszeit gegenüber konventionellen statischen Sortieralgorithmen across diverse Datensätze. Bei großskaligen Benchmarks mit n = 10⁹ Elementen benötigte AHS nur 210 Sekunden gegenüber 380 Sekunden für Timsort, was einer 45% Verbesserung entspricht. Für mittlere Datensätze (n = 10⁷) wurde ein 1.8× Speedup (2.1s vs 3.8s) erreicht, während die Speichernutzung konstant bei 8GB blieb gegenüber 12GB für Counting Sort, was die Eignung für moderne Big-Data-Anwendungen demonstriert."
