question_id,question_string,answer_llm,answer_gold,precision-1,recall-1,ROUGE-1,precision-2,recall-2,ROUGE-2,factual_correctness,completeness,relevance,justification,depth,overall_score,pass
P5_Q5,Wie wird Ashby's Law of Requisite Variety im Kontext der AI-Kontrolle erklärt und welche Implikationen ergeben sich daraus für Human-centric Oversight?,"Um Ashby's Law of Requisite Variety im Kontext der AI-Kontrolle zu verstehen, müssen wir zunächst das Gesetz selbst betrachten. Ashby's Law besagt, dass die Kontrolle eines Systems nur dann effektiv sein kann, wenn der Kontrollmechanismus mindestens so viel Vielfalt oder Komplexität aufweist wie das System, das kontrolliert werden soll. Im Bereich der künstlichen Intelligenz bedeutet dies, dass die Kontrollmechanismen, die wir entwickeln, um KI-Systeme zu überwachen und zu steuern, in der Lage sein müssen, die Komplexität und Vielfalt der KI-Systeme selbst zu bewältigen.

Im Kontext der AI-Kontrolle hat dies wichtige Implikationen für Human-centric Oversight, also die menschzentrierte Überwachung und Steuerung von KI-Systemen. Es bedeutet, dass Menschen, die für die Überwachung von KI-Systemen verantwortlich sind, über ausreichende Kenntnisse und Werkzeuge verfügen müssen, um die Komplexität dieser Systeme zu verstehen und zu kontrollieren. Dies könnte die Entwicklung spezialisierter Schulungen und Technologien erfordern, die es Menschen ermöglichen, effektiv mit KI-Systemen zu interagieren und sie zu überwachen.

Darüber hinaus impliziert Ashby's Law, dass es möglicherweise notwendig ist, die Vielfalt der Kontrollmechanismen zu erhöhen, um mit der zunehmenden Komplexität von KI-Systemen Schritt zu halten. Dies könnte die Integration von automatisierten Überwachungstools, Algorithmen zur Erkennung von Anomalien und anderen technologischen Lösungen umfassen, die die menschliche Aufsicht unterstützen und ergänzen.

Insgesamt unterstreicht Ashby's Law die Notwendigkeit, sowohl die menschlichen als auch die technologischen Aspekte der Kontrolle von KI-Systemen zu stärken, um sicherzustellen, dass diese Systeme sicher und effektiv betrieben werden können.","Ashby's Law of Requisite Variety besagt, dass für Sicherheitsgarantien ein Kontrollsystem generell mindestens so viel Komplexität haben muss wie das System, das es zu kontrollieren versucht. Im Kontext von Human-centric Oversight bedeutet dies, dass es natürliche Grenzen für die Kontrollierbarkeit von Systemen gibt, basierend auf Denkgeschwindigkeit, Proaktivität, Expertisegrad, Aufmerksamkeit für Details und Zuverlässigkeit menschlicher Operatoren. Selbst mit AI-Assistenz, die Menschen beim Verstehen des gegebenen Kontexts unterstützen, deutet das Gesetz darauf hin, dass das kontrollierende System mindestens so viel Ausdrucksfähigkeit haben muss wie das kontrollierte System. Dies stellt eine fundamentale Herausforderung für die Überwachung hochentwickelter AI-Systeme dar.",0.16666666666666666,0.40625,0.23636363636363636,0.07296137339055794,0.17894736842105263,0.10365853658536585,2,1,2,1,1,7,True
P5_META_Q1,Wer sind die Autoren des Papers 'The Singapore Consensus on Global AI Safety Research Priorities'?,"Es tut mir leid, aber ohne den spezifischen Kontext oder den Text des Papers kann ich die Autoren des Papers 'The Singapore Consensus on Global AI Safety Research Priorities' nicht nennen. Wenn du den Text oder weitere Informationen bereitstellen kannst, helfe ich dir gerne weiter.",Yoshua Bengio and Tegan Maharaj and Luke Ong and Stuart Russell and Dawn Song and Max Tegmark and Lan Xue and Ya-Qin Zhang and Stephen Casper and Wan Sie Lee and Sören Mindermann and Vanessa Wilfred and Vidhisha Balachandran and Fazl Barez and Michael Belinsky and Imane Bello and Malo Bourgon and Mark Brakel and Siméon Campos and Duncan Cass-Beggs and Jiahao Chen and Rumman Chowdhury and Kuan Chua Seah and Jeff Clune and Juntao Dai and Agnes Delaborde and Nouha Dziri and Francisco Eiras and Joshua Engels and Jinyu Fan and Adam Gleave and Noah Goodman and Fynn Heide and Dan Hendrycks and Cyrus Hodes and Bryan Low Kian Hsiang and Minlie Huang and Sami Jawhar and Wang Jingyu and Adam Tauman Kalai and Meindert Kamphuis and Mohan Kankanhalli and Subhash Kantamneni and Mathias Bonde Kirk and Thomas Kwa and Jeffrey Ladish and Kwok-Yan Lam and Wan Lee Sie and Taewhi Lee and Xiaojian Li and Jiajun Liu and Chaochao Lu and Yifan Mai and Richard Mallah and Julian Michael and Nick Moës and Simon Möller and Kihyuk Nam and Kwan Yee Ng and Mark Nitzberg and Besmira Nushi and Seán O hÉigeartaigh and Alejandro Ortega and Pierre Peigné and James Petrie and Benjamin Prud'Homme and Reihaneh Rabbany and Nayat Sanchez-Pi and Sarah Schwettmann and Buck Shlegeris and Saad Siddiqui and Aradhana Sinha and Martín Soto and Cheston Tan and Dong Ting and Robert Trager and Brian Tse and Anthony Tung K. H. and Vanessa Wilfred and John Willes and Denise Wong and Wei Xu and Rongwu Xu and Yi Zeng and HongJiang Zhang and Djordje Žikelić,0.0,0.0,0.0,0.0,0.0,0.0,0,0,1,0,0,1,False
P5_META_Q2,Welche Forschungsmethodik wurde im Paper 'The Singapore Consensus on Global AI Safety Research Priorities' hauptsächlich angewandt?,"Um die Frage zu beantworten, welche Forschungsmethodik im Paper 'The Singapore Consensus on Global AI Safety Research Priorities' hauptsächlich angewandt wurde, wäre es notwendig, den spezifischen Inhalt des Papers zu kennen. Da der Kontext nicht bereitgestellt wurde, kann ich nur allgemein sagen, dass solche Konsenspapiere oft Methoden wie Literaturrecherche, Expertenbefragungen, Workshops oder Delphi-Methoden verwenden, um zu einem Konsens über Forschungsprioritäten zu gelangen. Wenn du mehr Details oder den spezifischen Kontext hast, kann ich eine genauere Antwort geben.","Die hauptsächlich angewandte Forschungsmethodik war eine systematische Literatursynthese kombiniert mit einem strukturierten Expertenkonsultationsprozess. Das Dokument stellt eine umfassende Synthese von Forschungsvorschlägen dar, die aus dem International AI Safety Report-B und komplementären aktuellen Forschungspriorisierungsrahmen stammen, einschließlich Arbeiten von UK AISI, Anthropic, Anwar, Bengio, GDM, Hendrycks, Ji, Li, OpenAI, NIST, Reuel, Slattery und Weidinger. Der methodische Ansatz folgte einem mehrstufigen Verfahren: Zunächst erstellte das Expert Planning Committee einen Konsultationsentwurf, der dann an alle Konferenzteilnehmer der SCAI 2025 (über 100 Teilnehmer aus 11 Ländern) verteilt wurde. Nach mehreren Runden von schriftlichem und persönlichem Feedback wurde das Dokument iterativ überarbeitet, um Punkte des breiten Konsenses unter den diversen Forschern zu synthetisieren. Diese Methodik zielte darauf ab, sowohl die bestehende Literatur systematisch zu erfassen als auch durch den Multi-Stakeholder-Konsultationsprozess (Akademie, Industrie, Regierung, Zivilgesellschaft) eine breite Legitimität und Repräsentativität der identifizierten Forschungsprioritäten zu gewährleisten.",0.2077922077922078,0.11594202898550725,0.14883720930232558,0.02631578947368421,0.014598540145985401,0.018779342723004695,1,1,2,1,1,6,False
